Type,Title,Date,Text
Long Article,"Je, wanawake wanapokua anga za mbali wanakabilianaje na hedhi?",26 Machi 2025,"Sunita Williams pia aliingia angani kwa ajili ya safari ya anga za mbali ya ya siku nane lakini alilazimika kukaa huko kwa zaidi ya miezi 9. Wakati huo huo, Sunita Williams huenda alifikiria hilo au hakufikiria hili , kulingana na umri wake.
Lakini je, inakuwaje wakati mwanamke anapolazimika kuwa katia anga za mbali kwa miezi mingi angani kama yeye wakati wa siku za hedhi yake? Swali linatokea jinsi watakavyoshughulikia vipindi katika anga za mbali.
Kupata majibu sahihi kuhusu maswali haya, BBC imezungumza kwa mara ya kwanza na Dkt. Varsha Jain, 'daktari wa magonjwa ya wanawake wa anga za juu na ambaye amefanya kazi na NASA katika utafiti kuhusu afya ya wanawake angani.
Mnamo 2019, Dkt. Varsha Jain alizungumza na mwandishi wa BBC Emma Barnett kuhusu masuala haya.
Majibu ya Varsha Jain yamewasilishwa katika ripoti hii.
NASA ilikabiliwa na maswali sawa na hayo ilipomtuma mwanaanga wa kwanza wa kike wa NASA, Sally Ride, katika anga za mbali.
Wanaanga wakati huo walisema tusiwe na wasiwasi juu hilo hadi shida itakapojitokeza. Lakini wahandisi walilazimika kufanya mipango yote. Walipaswa kukadiria ni padi (visodo) vingapi vya za usafi ambavyo mtu angehitaji.
Wakati huo, ilikadiriwa kuwa vitambaa hivyo vya usafi 100 hadi 200 vinge hitajika kwa wiki. Baadaye, niligundua kuwa sikuhitaji visodo vingi.
Hivi sasa, wanaanga wa kike hutumia tembe za kudhibiti uzazi ili kukomesha hedhi zao. Maadamu wana afya njema, hakuna shida katika kuzitumia.
""Pia natafiti njia za kuepuka kupata hedhi.""
Mamia ya wanaanga kutoka nchi tofauti tayari wamekwenda angani, wakiwemo wanawake.
Mwanamke wa kwanza kwenda angani alikuwa Valentina Tereshkova kutoka Muungano wa Usovieti. Alipewa jukumu hili mwaka 1963.
Miaka 20 tu baadaye, shirika la anga za juu la Marekani NASA lilimtuma mwanaanga wake wa kwanza wa kike, Sally Ride, katia anga za juu.
Haya ndiyo maswali ambayo vyombo vya habari vilimuuliza Sally Ride alipoingia angani kwa mara ya kwanza.
CHANZO CHA PICHA,
NASA
Jibu la Varsha Jain kwa hili lilikuwa, ""Kuzoea mazingira ya anga ni sawa kwa wanawake na wanaume. Hata hivyo, kuna tofauti fulani.""
Wanawake wanahisi kiwango fulani cha uchovu au kuishiwa nguvu wanapoenda angani. Hivi ndivyo inavyotokea kwa wanaume wanaporudi duniani.
Wanaume wana uwezekano mkubwa wa kupata matatizo ya kuona na kusikia baada ya kurudi kutoka anga za juu, wakati wanawake wana uwezekano mkubwa wa kupata matatizo ya shinikizo la damu.
""Bado haijajulikana ikiwa hii inatokana na tofauti za kisaikolojia na homoni. Uchunguzi wa kina kuhusu masuala haya utaleta uelewa mzuri wa mabadiliko ya afya yanayosababishwa na safari ya anga ya muda mrefu.""
CHANZO CHA PICHA,
NASA
""Kuna vyoo viwili kwenye Kituo cha Kimataifa cha Anga cha Juu. Hata hivyo, havikuundwa kwa kuzingatia masuala ya hedhi pia.""
Mkojo wako hautapotea angani. Husindikwa tena na kutumika kutengeneza maji safi.
Hii ni kwasababu damu ya hedhi inachukuliwa kuwa ngumu. Vyoo kwenye kituo cha anga za juu haviwezi kutenganisha maji kutoka kwa hedhi, kwa hivyo maji ndani yake hayawezi kusindikwa tena.
""Kwa kuongeza, kuna baadhi ya vikwazo juu ya matumizi ya maji. Pia ni vigumu kudumisha usafi wa kibinafsi wakati wa hedhi unapokuwa katika anga za mbali.""
CHANZO CHA PICHA,
NASA
Dk. Varsha Jain anasema, ""Hakuna ushahidi kwamba usafiri wa anga una athari yoyote katika uzazi.""
Kuna wanawake na wanaume wengi ambao wamesafiri kwenda angani na wamepata watoto baada ya kurudi.
Hata hivyo, hatupaswi kusahau kwamba umri wa wastani wa wanawake wanaoanza safari ya anga za mbali ni miaka 38.
Ni uamuzi wao binafsi kuhifadhi mayai na mbegu zao za uzazi kwa ajili ya mimba zijazo. NASA haijaweka sheria zozote katika suala hili.
Wanaanga wako katika hatari ya kupata mionzi angani. Lakini hakuna habari juu ya athari kwenye uzazi.
Ubora wa mbegu za uzazi hupungua wakati wa kusafiri angani, lakini huongezeka tena baada ya kurudi Duniani. Madhara yake ya muda mrefu bado hayajajulikana.
""Wanawake huzaliwa na idadi ndogo ya mayai ambayo wanayo katika maisha yao yote. NASA inaunga mkono sana wanaanga ambao wanataka kuhifadhi mayai yao kabla ya misheni ya angani.""
CHANZO CHA PICHA,
NASA
""Nisingependa kutumia muda mwingi katika anga za juu kwasababu najua ya mabadiliko makubwa ya mwili yanayoweza kutokea .""
Mwili wa mwanadamu unaonekana kuzeeka haraka zaidi angani. Uzito wa mfupa hupungua. Haijalishi ni unajitunza vizuri kiasi gani au ni matibabu gani unayopata baada ya kurudi Duniani, bado huwezi kuepuka athari fulani.
Dk. Varsha Jain alisema, ""Pia nataka kuiona Dunia kutoka angani. Hata hivyo, naiona kama lengo la muda mrefu. Kwa sasa, ninafanya kazi yangu ninayoipenda duniani.""
© 2025 BBC. BBC haihusiki na taarifa za kutoka mitandao ya nje. Soma kuhusu mtazamo wetu wa viambatanishi vya nje.
"
Long Article,"Ndani ya ulimwengu wa ""mungu wa kike"" mwenye utata",20 Machi 2025,"Wanawake waliobeba mikoba ya Louis Vuitton na Gucci, waliovaa nguo za kitamaduni za kifahari na kupambwa kwa vito vya dhahabu na almasi, hukusanyika kwa kusanyiko la jioni la Radhe Ma.
Tofauti na watu wengi watakatifu, hapendi kuamka mapema, havai nguo rahisi, hafurahii mazungumzo marefu, na anajiita ""Mama wa Miujiza.""
Radhe Ma aliniambia, ""Miujiza hutokea kwa wafuasi wake, mahitaji yao yanatimizwa, kwa hivyo wanatoa michango.""
Watu hapa wanasimulia hadithi nyingi za jinsi Radhe Ma alivyowabariki wanandoa wasio na watoto, kuwasaidia wanawake ambao walikuwa wamejifungua watoto wa kike pekee hatimaye kuzaa watoto wa kiume, kuwaponya wagonjwa, na kusaidia kuokoa biashara ambazo zilikuwa karibu kuanguka.
Madai ya nguvu za kimungu sio ya kipekee kwa Radhe Ma. India imejaa wale wanaoitwa ""miungu ya kibinadamu,"" na ingawa hakuna takwimu sahihi rasmi, idadi yao inaonekana kuongezeka mwaka baada ya mwaka.
Baadhi yao huwakuepusha na mashtaka ya ufisadi, ukiukaji wa maadili, na hata unyanyasaji wa kijinsia. Radhe Ma alizungukwa na madai ya ushirikina (chawi) na kuwezesha malipo ya mahari, licha ya sheria ya India kukataza mazoea kama hayo. Lakini , uchunguzi wa polisi ulimalizika na mashtaka yote dhidi yake kufutwa.
Licha ya hayo, maelfu ya waja bado wanamiminika kuwaona wanaume na wanawake hawa, ambao wanachukuliwa kuwa vyombo vitakatifu, na mwaka jana, mkanyagano katika moja ya mikusanyiko hii ulisababisha vifo vya zaidi ya watu 120.
""Wahindi wengi hukulia katika familia zinazoamini kwamba nguvu za kimungu zinaweza kupatikana kupitia ibada, kutafakari, au maombi, na kwamba wale wanaozipata wana uwezo wa kufanya miujiza,"" anasema Shyam Manav, rais wa Shirika la India la Kupambana na Ushirikina.
Anaongeza: ""Mtu kama huyo anachukuliwa kuwa kiumbe wa kimungu, au anaitwa mtakatifu
Nilikutana na Pushpinder Bhatia, mhitimu wa Shule ya Biashara ya Saïd ya Chuo Kikuu cha Oxford na mkurugenzi wa ushauri wa elimu, alipokuwa amesimama kwenye foleni ya wanawake wakisubiri kukutana na Radhe Ma. Aliniambia hakuwahi kufikiria angejikuta mwanafunzi wa ""kiumbe mkuu aliyepata mwili katika umbo la mwanadamu.""
Aliniambia, ""Mwanzoni, nilikuwa na maswali mengi: Je, mungu anaweza kweli kupata mwili katika umbo la mwanadamu? Je, hii ni kweli? Je, kweli anaweza kutoa baraka zinazobadilisha maisha ya mtu? Na ni nini siri ya miujiza hii wanayodai kutokea?""
Lakini , Bhatia alikutana na Radhe Ma baada ya msiba kuikumba familia yake.
Ingawa wengine wanaweza kufikiria alikuwa katika hali yake dhaifu ya kisaikolojia wakati huo.
Anasema, ""Nadhani katika mkutano wangu wa kwanza wa kiroho naye, nilihisi mvuto mkubwa kwa mazingira yaliyomzunguka. Ninaamini kwamba unapovuka sura yake kibinadamu, unahisi uhusiano wako na yeye kwa haraka.""
'darshan' (kukutana kiroho) na Radhe Ma ni wakati unaotafutwa na wengi, na nilishuhudia mkutano mmoja kama huo, ambao ulifanyika usiku wa manane katika nyumba ya kibinafsi huko Delhi.
Miongoni mwa mamia ya waja walikuwa wafanyabiashara mashuhuri na familia ya afisa mashuhuri wa polisi, ambao wote walikuwa wamekuja kutoka mbali kabisa kumuona.
Nilikuwa pale kama mwandishi wa habari, nikitazama na kurekodi kile kilichokuwa kikitokea, lakini niliambiwa kwamba kwanza kabisa lazima nipokee baraka zake, na haraka nilijikuta nikisukumwa mbele ya foleni ndefu. Si hivyo tu, lakini nilipewa maagizo sahihi juu ya jinsi ya kufanya sala, na maonyo kwamba kosa lolote ndani yake linaweza kuleta madhara kwa familia yangu.
Katika chumba hicho kilichopambwa kwa rangi nyekundu na dhahabu, rangi zinazopendwa na Radhe Ma, macho yake yalitawala kila kitu.
Wakati mmoja nilimwona akiwa amejawa na furaha, iliyofuatwa na hasira, hasira ambayo ilionekana kuenea kwa kushangaza wafuasi wakewake, ambaye mara moja alionekana kupoteza fahamu, na kisha chumba kikanyamaza wakati mwanafunzi huyo alipoanza kuzunguka sakafuni.
Dakika chache baadaye, baada ya wafuasi wake kumuomba msamaha, wimbo maarufu wa Kihindi ulicheza na akaanza kucheza, akiashiria kurudi katika hali ya utulivu. Kisha foleni ya wafuasi ilianza kusonga tena.
Radhe Maa asili yake ni jimbo la kaskazini mwa India la Punjab.
Mzaliwa huyo wa Sukhwinder Kaur katika familia ya tabaka la kati katika kijiji chenye maisha ya chini, anadai kuwa alipata nguvu za kimungu baada ya kupokea uchawi kutoka kwa gwiji wa kiroho.
""Wakati ambapo watoto wenzake walikuwa na ndoto ya kuwa marubani au madaktari, Radhe Ma kila wakati aliuliza swali, 'Mimi ni nani?' Kwa hivyo, baba yetu alimpeleka kwa gwiji mashuhuri wa kiroho, ambaye alimtangaza kuwa mungu mwenye mwili katika umbo la mwanadamu,"" anasema dada yake Rajinder Kaur.
Dada yake anasimamia hekalu dogo, la chumba kimoja liitwalo Radhe Ma, lililojengwa na mumewe, Mohan Singh.
""Tunamwita 'Papa,' kwasababu kwa kuwa yeye ni mama yetu, yeye ni baba yetu,"" Kor anaongeza.
Radhe Ma alipofikia umri wa miaka ishirini, wakati mumewe alikuwa nje ya nchi, alikabidhi utunzaji wa wanawe wawili kwa dada yake na kuanza kutumia maisha yake katika nyumba za waja wake, ambao wengi wao walikuwa wafanyabiashara.
Alisafiri kutoka jiji hadi jiji hadi mwishowe akaishia Mumbai, moyo kitovu cha uchumi wa India, ambapo alikaa zaidi ya miaka kumi chini ya uangalizi wa mfanyabiashara kabla ya kurudi kwa familia yake.
Watetezi waaminifu na wenye bidii zaidi wa hekalu hilo ni wafuasi ambao wameishi katika nyumba zake kwa miaka, na ambao wanadai kuwa hii imechangia ustawi wao.
Radhe Ma anaishi katika ulimwengu wa ajabu, ambapo ""uungu"" unaodhaniwa umeunganishwa na mtandao wa mali na mahusiano ya kidunia.
Radhe Ma kwa sasa anaishi katika jumba la kifahari lililojengwa kwa ajili yake na wanawe wawili, wote wafanyabiashara waliofanikiwa kibiashara.
Lakini, anaishi kwenye gorofa lake mwenyewe, tofauti na jumba lingine, hajawahi kuiacha isipokuwa kupokea wageni au kusafiri kwenda jiji lingine kwa hafla ya umma.
""Kwanza, haishi nasi. Sisi ndio waliobahatika kuishi chini ya ulinzi na baraka zake. Pili, hatuoni sisi kama familia yake. Anatuona kama waja tu,"" anasema mkwe wake wa kike, Megha Singh, ambaye ana jukumu la kuandaa shughuli zake zote za umma.
Familia ya Radhe Ma na washirika wake wachache waumini wa karibu wanasimamia michango anayopokea.
""Michango anayopokea huwekwa katika shirika la misaada linaloendeshwa na waja wake, ambao hukagua maombi ya wale wanaohitaji na kisha kusambaza pesa au zawadi.
Hata hivyo, mwanamke huyu, ambaye anaonekana kama sanamu, anafurahia kuvaa nguo za kifahari na kujipamba kwa vito vya mapambo.
""Ninapenda kuvaa nguo za kifahari na lipstiki nyekundu, ndivyo kila mwanamke aliyeolewa anapaswa kufanya,"" anasema Radhe Ma. ""Lakini mimi si shabiki wa vipodozi,"" anasema, ingawa anavaa sana.
""Ukiwa na sanamu takatifu ya binadamu, unachagua mavazi ambayo yanafaa zaidi. Kwa nini usifanye vivyo hivyo na mungu aliye hai? Tumebarikiwa na uwepo wake, na tumebarikiwa kwa heshima ya kuitumikia,"" Megha Singh anaongeza.
Ikumbukwe kwamba mnamo 2020, Radhe Ma alionekana kwenye toleo la Kihindi la Big Brother kutoa baraka zake kwa nyumba ya washiriki, aking'aa katika mavazi yake mekundu na kubeba mkuki wa dhahabu.
Picha yake ya sasa ni tofauti kabisa na picha zake kama msichana wa kawaida ambazo wafuasi wake walinionyesha wakati wa ziara yangu huko Punjab.
Mja mmoja, Santosh Kumari, anaweka picha za Radhe Ma kwenye chumba maalum nyumbani kwake. Alinieleza kuwa imani yake kwake ilitokana na baraka aliyopokea wakati mumewe alikuwa hospitalini baada ya mshtuko wa moyo, ambao baadaye alipona.
Aliniambia, ""Alitokwa na damu kutoka kinywani mwake, na akaipaka kwenye paji la uso wangu, kisha akasema, 'Hutaumia, mume wako atapona.'""
Nilishangaa pia wakati waumini kadhaa walipozungumza juu ya ulimi wa Radhi Ma kugeuka mwekundu na wenye damu, wakiamini kwamba haya yalikuwa ni matokeo ya udhihirisho wa nguvu za kimungu alizonazo.
Kumari ni mmoja wa wanawake wapatao 500, wengi wao wakiwa wajane, ambao hupokea pensheni ya kila mwezi ya kati ya rupia 1,000 na 2,000 (takriban $11 hadi $22) kutoka kwa Shri Radhe Maa Charitable Trust.
Walengwa wengine wa pensheni pia walisimulia hadithi za miujiza, lakini wakati mwingine waliongeza maelezo ya tahadhari.
""Hatuwezi kusema chochote juu yake,"" alisema Sarjit Kaur kwa tahadhari. ""Inaweza kutuletea madhara. Ikiwa sitawasha taa kwa ajili yake, kitu kibaya kitanitokea na nitajikuta nimelazwa kitandani.""
Kaur hakosi siku bila kuwasha taa kwa Radhe Ma, kwani moyo wake umejaa imani thabiti katika nguvu zake za kimungu.
Profesa Manav anahusisha hii na hofu ya mfuasi wake kupoteza baraka ya ""sanamu"" hii.
Anasema, ""Kulingana na sheria ya uwezekano, utabiri fulani hutimia, na mtu mtakatifu anapewa sifa kwa hilo. Lakini wakati utabiri ni mbaya, hawajibishwi. Badala yake, kosa hilo linahusishwa na mapungufu ya mtu binafsi, iwe katika maombi yake, imani yake dhaifu, au hata bahati mbaya yake.""
Wachache wa wale niliokutana nao kwenye mikusanyiko ya hadhara ya Radhe Ma walionyesha waziwazi kutoamini uwezo wake wa kufanya miujiza.
Mtu mmoja alielezea madai hayo kama ""hadithi tu,"" wakati mwingine alionyesha vipodozi na nguo za bei ghali, akidai kuwa mambo haya hayafanyi mtu kuwa ""kama mungu,"" akiongeza kuwa hajaona ushahidi wowote wa yeye kufanya miujiza mwenyewe.
Lakini, hawakusita kuhudhuria mikusanyiko ya umma ya Radhe Ma, wakiiona ""ya kufurahisha na ya kuburudisha"" na walikuwa na hamu ya kumuona mwenyewe baada ya kumtazama kwenye onyesho halisi.
Wakati wa safari yangu, nilikutana na baadhi ya waja wa zamani wa Radhe Ma, ambao walithibitisha kwamba unabii wake haukutimia na hata kuwadhuru, lakini walipendelea kutotajwa jina.
Hii iliongeza udadisi wangu juu ya wafuasi wake, na kiwango cha imani yao katika uungu wake na utii wao kwake.
Jioni moja, alishtuka kuona Radhe Ma akiuliza wandani wake, ambao walikuwa wamekaa sakafuni, kuigiza sauti za wanyama, na mara moja walitii amri zake.
Niliwaambia wafanye kama mbwa na nyani, na wakaanza kubweka, kulia, na kufanya ishara za kukwaruza.
Sijawahi kuona kitu kama hiki hapo awali, na kwa kuwa binti-mkwe wa Radhe Ma, Megha Singh, alikuwa chumbani, nilimuomba aelezee maana ya tabia hii.
Hakukuwa na ishara ya mshangao usoni mwake.
Alianza hotuba yake kwa kusema kwamba mwanamke huyu mtakatifu hakuwa ameondoka kwenye mipaka ya chumba chake kwa zaidi ya miaka thelathini.
""Kwa hivyo, tabia hii ndio chanzo pekee cha burudani inayopatikana kwake, na tunatafuta kusema utani au kuleta furaha moyoni mwake kupitia vitendo hivi,"" aliongeza.
Hii ilinikumbusha onyo ambalo nilikuwa nimesikia mara nyingi, kwamba wafuasi wake wanapaswa kuwa na imani thabiti bila kutoridhishwa.
Nilimuuliza mja anayeitwa Pushpinder Singh ni nini Radhe Ma nawataka wafuasi wake wafanye?. Alijibu, ""Yeye hajawaomba lolote, isipokuwa kusema, 'Unapokuja kwangu, na iwe kwa moyo wazi na imani thabiti. Nimeiona mwenyewe. Watu wanapokuja na imani hii, miujiza hutokea kwao. Lakini ikiwa watakuja kumuona, ninaamini kwamba kwa heshima na adabu zote, hawatakuwa tena na nafasi katika kikundi hicho.'""
Profesa Manav anaamini kwamaba maelezo haya bila shaka ndio kiini cha ""hadithi.""
Tunaambiwa kwamba hekima inaweza kupatikana tu kupitia imani isiyotikisika kwa mwalimu, na yeyote anayemtilia shaka au anayetaka kumjaribu anapoteza imani yake na baraka zake.
Je, ni hadithi au imani? Radhi Ma ana hakika kwamba waja huendelea kuwa waaminifu.
Anasema hajali wale wanaomwita mlaghai.
""Sijali,"" anatabasamu.
Anaongeza, ""Mungu ananiona kutoka juu na ananitunza.""
© 2025 BBC. BBC haihusiki na taarifa za kutoka mitandao ya nje. Soma kuhusu mtazamo wetu wa viambatanishi vya nje.
"
Long Article,Kwanini makavazi ya kisasa yamekuwa gumzo Nairobi?,4 Machi 2025,
Long Article,'Walidhani nitajifungua mtoto mwenye ulemavu sawa na wangu',26 Februari 2025,"Hata hivyo, sheria mpya ya kitaifa ya kuwalinda waalemavu, inaahidi kubadilisha hilo kwa kuhakikisha kuwa wanatambuliwa kisheria na kujumuishwa zaidi katika masuala ya kitaifa.
Lakini wanaharakati wanasema changamoto halisi sasa ipo katika utekelezaji.
Mwandishi wa BBC Fardowsa Hanshi, amerejea kutoka Mogadishu na kutuandalia taarifa ifuatayo.
© 2025 BBC. BBC haihusiki na taarifa za kutoka mitandao ya nje. Soma kuhusu mtazamo wetu wa viambatanishi vya nje.
"
Long Article,"'Wasiwasi wangu mkubwa ni kwa binti yangu, inamaana tutakufa?'",21 Februari 2025,
Long Article,Fahamu mambo makuu aliyofanya Trump ndani ya mwezi mmoja,21 Februari 2025,"© 2025 BBC. BBC haihusiki na taarifa za kutoka mitandao ya nje. Soma kuhusu mtazamo wetu wa viambatanishi vya nje.
"
Long Article,M23 ndani ya Bukavu: Je inaweza kuleta vita vya kikanda?,18 Februari 2025,"© 2025 BBC. BBC haihusiki na taarifa za kutoka mitandao ya nje. Soma kuhusu mtazamo wetu wa viambatanishi vya nje.
"
Long Article,"Siku ya Redio Duniani: Je, watangazaji maarufu wanasema nini kuhusu umuhimu wa redio",04:25,". Katika kuadhimisha siku hii BBC Swahili imezungumza na waandishi wa habari Salim Kikeke, Caro Robi na Regina Mziwanda, wakielezea kuhusu umuhimu wa redio na jinsi wanavyoienzi taaluma yao.
© 2025 BBC. BBC haihusiki na taarifa za kutoka mitandao ya nje. Soma kuhusu mtazamo wetu wa viambatanishi vya nje.
"
Long Article,Fahamu simu yako inahusika vipi na Mgogoro wa DRC?,03:10,"© 2025 BBC. BBC haihusiki na taarifa za kutoka mitandao ya nje. Soma kuhusu mtazamo wetu wa viambatanishi vya nje.
"
Long Article,Hatua ya Trump kuondoa ufadhili; Wafanyakazi katika mashirika Tanzania wana siutafahamu,5 Februari 2025,"Athari hizo zinatokana na Marekani kuwa mchangiaji mkubwa wa kifedha wa WHO na programu mbali mbali zilizopo chini ya shirika hilo na taasisi nyingine kubwa za kiafya duniani.

Siku ya Jumanne juma lililopita, wakandarasi na washirika wanaofanya kazi na Shirika la Misaada la Marekani (USAID) nchini Tanzania na Kenya walianza kupokea barua hizo ili kusitisha ufadhili huo mara moja, kulingana na vyanzo.
Tanzania nchi ambayo ilikuwa ikifaidika na misaada hiyo, amri hiyo ya Rais Trump mbali na kuathiri sekta ya Afya, pia inaweka hatarini ajira za watu.
Johansen Josephat, Afisa Mawasiliano Kutoka Shirika lisilo la kiserikali linalojihusisha na uboreshaji wa huduma ya afya kwa umma nchini Tanzania ametoa maoni yake kwa kueleza jinsi walivyoguswa.
Johansen akizungumza na BBC anasema hatua hii imekuwa pigo lakini wanajaribu kushirikiana na serikali kuangalia kwa namna moja au nyingine kuhakikisha kwa namna gani wanaendelea kutoa nguvu au mchango katika mapambano dhidi ya maambukizi ya virusi vya UKIMWI.
''Ukiangalia kuna maelfu ya watanzania ambao tayari wana hii changamoto ya maambukizi ya Virusi vya Ukimwi wanaotumia dawa, kwahiyo sisi kama wadau wa serikali tumekuwa kama mkono wa pili wa serikali, kusititishwa huku kwa ufadhili kutoka Marekani kunakwenda moja kwa moja kwa wale waajiriwa walioko vituoni,.ni kwamba zile huduma vituoni zitarudi.
CHANZO CHA PICHA,
REUTERS
Trump ni mkosoaji wa muda mrefu wa Marekani kutumia fedha zake kufadhili mataifa mengine akisema hauwakilishi thamani kwa kodi wanazotoa Wamarekani.
Amekosoa vikali USAID, akielezea viongozi wake wa juu kama ""watu wasiojielewa .""
Kufunga shirika hili kutaweza kupigiwa upatu kutoka kwa Wamarekani.
Tafiti za maoni kwa muda mrefu zimeonesha kuwa wapiga kura wa Marekani wanapendelea serikali yao kupunguza matumizi ya misaada ya kigeni.
Kwa mfano, moja ya hatua za kwanza alizochukua Trump alipochaguliwa tena ilikuwa kusaini amri ya kiutendaji inayohusisha kusitisha takribani matumizi yote ya kimataifa kwa muda wa siku 90 ili kupitia upya matumizi hayo.
Notisi ikatolewa ikisitisha shughuli zinazoendelea zisimamishwe mara moja.
Muda mchache baadaye agizo likatolewa kuwa baadhi ya programu za kibinadamu ziendelee, ingawa agizo la awali lilikuwa limevuruga shughuli kadhaa kote ulimwenguni.
Johansen amekiri kuwa amri ya Trump ni pigo lakini 'tunajaribu kushirikiana na serikali kuangalia kwa namna moja au nyingine, tunahakikisha kwa namna gani tunaendelea kutoa nguvu au mchango katika mapambano dhidi ya maambukizi ya virusi vya UKIMWI', Alisema.
''Ukiangalia kuna maelfu ya watanzania ambao tayari wana hii changamoto ya maambukizi ya Virusi wanaotumia dawa, kwahiyo sisi kama wadau wa serikali tumekuwa kama mkono wa pili wa serikali,kusititishwa huku kwa ufadhili kutoka Marekani kunakwenda moja kwa moja kwa wale waajiriwa walioko vituoni.''
Moja kati ya miradi inayohudumiwa na watu wengi,ni miongoni mwa iliyoathirika kufuatia kufungwa kwa ufadhili wa marekani barani Afrika kupitia CDC.
Idadi kubwa ya wafanyakazi wa shirika la misaada MDH wapo ktk siutafahamu wakisubiri kujua hatma ya ajira zao wakati huu mashirika ya misaada ambayo yamekuwa yakiendeshwa kwa ufadhili wa serikali ya Marekani yakiwa yamefungwa.
''Sisi ni Watanzania na miongoni mwetu ni walengwa wa hili tutaendelea kujitolea kufanya kazi za utoaji wa huduma elimu na dawa kwa wanaoishi na changamoto ya maambukizi ya virusi vya UKIMWI kwa kupitia manispaa zetu.
''Tukisema tunasubiri mfadhili wakati tuna watu wanaoishi kwa kutegemea hizi dawa,tuliamua kuendelea kutoa huduma bila kujali maslahi'', Alisema Johansen.
Kulingana na data za serikali, Marekani iligharamika dola bilioni 68 katika misaada ya kimataifa mwaka 2023.
Jumla ya fedha hizo zimegawanyishwa kwa mashirika na idara mbalimbali, lakini bajeti ya USAID inajumlisha zaidi ya nusu ya fedha hizo ikipokea takriban dola bilioni 40.
Fedha nyingi hutumika katika bara Asia, mataifa ya Afrika yaliyo kusini mwa jangwa la Sahara na Ulaya- hasa katika juhudi za kibinadamu nchini Ukraine.
Marekani ni taifa ambalo linaongoza kufadhili misaada ya kimataifa duniani.
Uingereza ikiwa nafasi ya nne kufadhili misaada ya kimataifa hasa katika shughuli za kibinadamu.
© 2025 BBC. BBC haihusiki na taarifa za kutoka mitandao ya nje. Soma kuhusu mtazamo wetu wa viambatanishi vya nje.
"
Unknown,,,
Short Article,Mazungumzo ya kwanza ya moja kwa moja kati ya DRC na waasi wa M23 kufanyika leo huko Doha,9 Aprili 2025,"CHANZO CHA PICHA,
REUTERS
Jamhuri ya Kidemokrasia ya Congo (DRC) na kundi la waasi la M23 wanatazamiwa kufanya mazungumzo yao ya kwanza ya moja kwa moja leo mjini Doha.
Hii inaashiria hatua iliyopigwa kuelekea juhudi za kumaliza moja ya migogoro mikali zaidi katika Afrika ya Kati katika miongo kadhaa.
DRC, Umoja wa Mataifa na majumuiya ya kikanda yanaishutumu Rwanda kwa kuunga mkono M23 na kuwapa msaada wa silaha na kijeshi, ingawa Kigali inakanusha hili.
Akihutubia wakati wa shughuli ya kuashiria mwanzo wa mfululizo wa kumbukumbu ya mauaji ya kimbari ya mwaka 1994 jana Jumanne, Rais wa Rwanda Paul Kagame amesema bila kuzitaja nchi zozote, kuwa zinapaswa kuyashughulikia matatizo yao na kumuwacha yeye akabiliane na ya kwake.
Mwezi Desemba mwaka jana, mazungumzo ya amani yaliyosimamiwa na Angola yalivunjika baada ya Rwanda kuitaka serikali ya Congo kuzungumza moja kwa moja na M23.
Siku moja baada ya M23 kujiondoa kwa mazungumzo ya amani ,tarehe 18 mwezi Machi Rais wa Jamhuri ya Kidemokrasia ya Congo (DRC) Felix Tshisekedi na mwenzake wa Rwanda, Paul Kagame walikutana nchini Qatar kwa mazungumzo yao ya kwanza ya ana kwa ana mpatanishi mkuu akiwa ni Amir wa Qatar.
Haya yanajiri baada ya Angola kujiondoa kama mpatanishi mkuu wa mzozo kati ya Kongo na M23.
Kundi la waasi lilisonga mbele kwa kasi, na kuchukua udhibiti wa miji miwili muhimu - Goma na Bukavu.
Mzozo wa mashariki mwa Kongo umedumu kwa muda sasa, madini yakitajwa kama kichochea kikubwa. Mzozo umeongezeka haraka tangu Januari 2025, na maelfu ya watu waliuawa na mamia ya maelfu kulazimishwa kuyakimbia makazi yao.
Pia unaweza kusoma:
M23 Kujiondoa Kwenye Mazungumzo ya Amani DRC: Nini Kinachofuata?
Mzozo wa DRC: Congo yakaidi wito wa kufanya mazungumzo na M23
Fahamu tahadhari aliyoitoa Nyerere kuhusu mgogoro wa mashariki ya DRC
"
