Type,Title,Date,Text
Long Article,'Nilikuwa muamuzi wa Primia Ligi lakini sasa najifunza kutembea tena',3 Aprili 2025,"Rennie, ambaye alisimamia zaidi ya mechi 300 za ligi kuu kati ya 1997 na 2008, alikuwa katika safari ya kusherehekea siku ya kuzaliwa Uturuki mwaka jana alipokumbwa na maumivu ya ghafla kwenye mgongo wake.
""Nilidhani nilikuwa nimelala tu kwenye chumba cha kupumzika cha jua, nilitarajia kwenda upanda mwavuli angani lakini kwasababu ya maumivu ya mgongo sikuweza kwenda,"" anasema.
""Mwisho wa likizo sikuweza kulala , nilikaa macho kutokana na maumivu, na nilipofika nyumbani nilitembea kwa shida.""
CHANZO CHA PICHA,
RICHARD SELLERS/SPORTSPHOTO/ALLSTAR/GETTY
Rennie aliweka historia mwaka wa 1997 aliposimamia mechi kati ya Derby County na Wimbledon, na kuwa mwamuzi wa kwanza mweusi wa daraja la juu.
Mwanaume huyu ambaye ni mrefu kwa kimo na mtaalam wa ndondi za mateke na aikido, wachezaji waliokuwa wakipinga waligundua kwa haraka kwamba alikuwa amejiweka sawa wakati wa makabiliano
Akiwa mwamuzi huko Sheffield tangu 1996, amefanya kampeni katika masuala kama vile kuboresha usawa na ushirikishwaji katika michezo, kusaidia afya ya akili na kukabiliana na kunyimwa.
Rennie alikuwa kwenye harakati za kuanza kazi mpya kama Chansela wa Chuo Kikuu cha Sheffield Hallam alipolazwa katika Hospitali Kuu ya Kaskazini mnamo Oktoba.
""Nililala kwa mwezi mmoja chali na miezi minne mingine huku nikiwa nimekaa kitandani,"" anasema.
""Waliniweka hospitalini hadi Februari, walikuta kinundu kikinisukuma kwenye uti wa mgongo na ilikuwa ni hali ya nadra ya mishipa ya fahamu hivyo si kitu ambacho wanaweza kukifanyia upasuaji.
""Imebidi nijifunze kutembea tena, ninarekebisha miguu yangu.""
CHANZO CHA PICHA,
STU FORSTER/ALLSPORT/GETTY
""Ilikuwa ya kushangaza ...Sikuwa na matatizo yoyote ya nyuma ya awali lakini ghafla sikuweza kutembea nilikuwa katika kitengo cha wagonjwa wa mgongo.""
Akizungumzia harakati zake za sasa, anasema: ""Ninaweza kusongesha miguu yangu na ninaweza kusimama na mikongojo iliyounganishwa kwenye kiti changu cha magurudumu .""
Kwa mzaha anaonyesha kiti cha magurudumu kwenye bodi karibu na nyumba yake, na mazoezi ya viungo - physiotherapy, inachukua muda mwingi wa siku yake.
""Ninatikisika kwenye kiti changu nikifanya mazoezi yangu, mimi ni mgonjwa mzuri sana, anayetii,"" anacheka.
""Hali hii imekuwa ya kufadhaisha lakini familia na marafiki wamekuwa wa maana sana, hospitali ilikuwa nzuri kabisa na chuo kikuu kimekuwa cha kipekee.""
Anaanza rasmi kazi kama chansela wa chuo kikuu mwezi Mei, kazi ambayo ameazimia kuichukua licha ya hali yake iliyompata hivi majuzi.
""Nilisisitiza nilitaka kuleta mabadiliko katika Sheffield na kwa jamii za hapa,"" anasema.
""Niliendelea kufanya kazi na timu za michezo za kijamii nikiwa hospitalini, nikiwaelekeza kutoka kitandani mwangu.""
Alisomea MBA katika chuo kikuu wakati wa taaluma yake ya uamuzi na akapokea shahada ya udaktari wa heshima mnamo 2023 kwa kazi yake ya michezo na jamii za mitaa.
""Ninalenga kuwa bora zaidi niwezavyo kimwili,"" anasema.
""Hakuna mtu aliyeniambia sitatembea tena, lakini hata kama mtu alisema kwamba nataka kusema nilifanya kila niwezalo kujaribu.""
Rennie, ambaye alihamia Uingerza kutoka Jamaica akiwa mtoto mdogo na kukulia katika eneo la Wybourn mjini humo, anasema kuwa muamuzi wa kwanza mweusi ilikuwa ni ""kuunda urithi wa kuwawezesha watu wengine kusimama kwenye mabega yako"".
Akizungumzia changamoto yake ya hivi punde, anasema matatizo ya uti wa mgongo yamempa mtazamo mpya wa maisha.
""Watu wengi wako kwenye viti vya magurudumu, lakini haviwazuwii kutimiza ndoto zao,"" anasema.
""Imenifanya niwe mvumilivu na mwenye nguvu na sitakata tamaa kamwe - siko peke yangu, kuna kijiji kinanisaidia.""
Anamalizia hivi: ""Ninatambua jinsi mambo yalivyo magumu maishani sasa.
""Sijui kama nitatembea kikamilifu, lakini najua ninachohitaji kufanya ili kujaribu na kamwe usikate tamaa.""
© 2025 BBC. BBC haihusiki na taarifa za kutoka mitandao ya nje. Soma kuhusu mtazamo wetu wa viambatanishi vya nje.
"
Long Article,"Arsenal 'yaibaragaza' 3-0 Madrid, matokeo yanayoipa England timu 5 Mabingwa Ulaya",Saa 3 zilizopita,"Eduardo Camavinga alitolewa kwa kadi nyekundu dakika za mwisho baada ya kupata kadi ya pili ya njano, ingawa kadi yake ya kwanza ilikuwa tayari imemfanya akose mchezo wa marudiano.
Madrid, moja ya vilabu vikubwa na vyenye historia katika michuano hiyo, kuchapwa idadi hiyo ya mabao, ikiwa na wachezai bora kwa sasa duniani, Vinícius Júnior na Kylian Mbappé Lottin ni kumbukumbu isiyofutika kwa arsenal.
Timu hizo mbili zitarudiana tena Jumatano ijayo kwenye Uwanja wa Bernabeu.
Mara ya mwisho Arsenal kushinda, Ilikuwa msimu wa 2005-06, Thierry Henry akifunga bao pekee na kuibuka na ushindi wa bao 1-0, kufuatia sare tasa ya 0-0 katika uwanja wa Highbury.
Kwa ushindi huu, arsenal imeiwezesha england sasa kupata nafasi moja zaidi ya ya timu zake kushiriki michuano ijayo ya Klabu bingwa. Maana yake sasa zitakwenda timu tano badala ya timu nne.
CHANZO CHA PICHA,
GETTY IMAGES
Baada ya mchezo huo, ulihudhuriwa na masupa staa wengi wa zamani, kulikuwa na maoni kadhaa.
Cesc Fabregas: Kiungo wa zamani wa Arsenal na Hispania anasema...
""Ningependa kusema imekwisha (Arsenal kafuzu nusu fainali). Lakini baada ya bao la kwanza nilisema walihitaji la pili na baada ya la pili walihitaji la tatu.
Lakini Real Madrid ni Real Madrid"".
Matt Upson: Beki wa zamani wa Uingereza ameiambia BBC Radio 5 Live
""Ni mapema sana kuzungumzia nusu fainali.
Real Madrid imekuwa katika hali mbaya au mbaya zaidi kuliko hii hapo awali na kufanikiwa kupata suluhu. Ikiwa kuna timu yoyote nyumbani ambayo itaigeuza matokeo basi itakuwa wao.
Je, watakuwa na uwezo? Itabidi tusubiri na kuona, lakini Arsenal watajiamini zaidi katika mechi ya marudiano""
Declan Rice: mfungaji wa mabao mawili na nyota wa mchezo....
""Sijui kama nitasahu. Nimeangaliasimu yangu basi na imekuwa wazimu. Kufunga goli langu la kwanza la free-kick katika mchezo kama huu ni jambo maalum. Na kisha nilipopata ya pili. Nilikuwa na ujasiri tu. Sina la kusema kweli.
""Kuifunga Real Madrid katika mashindano haya. Ni usiku mkubwa kwetu.
""Kocha alisema hata kama tunaongoza kwa mabao 3-0 ubora wa mtu mmoja mmoja walio nao Madrid unatisha. Huko Bernabeu mambo maalum hutokea kwao. Tunataka kuwa katika nusu fainali ya Ligi ya Mabingwa.""
Matokeo mengine ya klabu bingwa Ulaya, Bayern Munich imechapwa nyumbani 2-1 na Inter Milan, leo PSG inaikaribisha Aston Villa, Borrusia Dortmund itakuwa kumenyana na Barcelona
© 2025 BBC. BBC haihusiki na taarifa za kutoka mitandao ya nje. Soma kuhusu mtazamo wetu wa viambatanishi vya nje.
"
Long Article,'G-55 na No Reform No Election' zinavyoiweka CHADEMA njia panda ya kisiasa,8 Aprili 2025,"Ingawa yapo mabadiliko kadhaa yamefanyika mwaka jana kusainiwa kwa Sheria inayosimamia uchaguzi Mkuu wa Rais, wabunge na madiwani ya mwaka 2024, Sheria ya Tume Huru ya Taifa Ya Uchaguzi namba mbili ya 2024 na Sheria ya Marekebebisho ya Sheria ya Vyama vya Siasa namba tatu ya mwaka 2024, CHADEMA inayaona kama 'danganya toto'.
Ikapitisha azimio au msimamo wa ""No Reforms, No Election"" unaolenga kuzuia uchaguzi mkuu wa mwaka huu, mpaka kufanyike marekebisho makubwa ya mifumo na sheria za uchaguzi, kwa kile inachodai sheria na mifumo ya uchaguzi iliyopo sasa inaipendelea zaidi chama tawala.
Msimamo huo sasa unaonekana kukipitisha chama hicho kwenye mtihani mkubwa wa kuamua mustakabali wake kisiasa, hasa baada ya kibuka wanaoupinga likiwemo kundi la wanachama wanaojiita G-55 waliojitokeza hadharani, na kukoleza migawanyiko ya ndani inayotishia ushawishi wake na umoja wake.
CHANZO CHA PICHA,
THE GUARDIAN
Mwaka 1993, kuliibuka kundi la wabunge 55 waliojiita G-55 ndani ya Chama tawala chini humo, Chama cha Mapinduzi (CCM), lililotaka mabadiliko ndani ya chama ya kuleta Serikali ya Tanganyika ndani ya Tanzania. Lilitikisa sana utawala wa Rais wa wakati huo, Ally Haasan Mwinyi, na lilionekana kama kundi la waasi.
Kama si kuingilia kati kwa viongozi wakuu akiwemo Rais wa kwanza wa Tanzania, Mwalimu Julius Nyerere, leo pengine kungekuwa na mpasuko zaidi ndani ya chama na kubadili siasa za nchi kwa miaka mingi. Harakati za kundi hilo, zimesalia kuwa historia kubwa Tanzania.
Miaka 32 baadae linaibuka kundi lingine G-55 ndani ya CHADEMA, linaloupinga wazi Msimamo wa No Reform, No Election.
'Wanaotaka uchaguzi ni wengi kuliko wanaotaka kuzuia uchaguzi, kwa sababu hawaoni huo muujiza wa kuzuia uchaguzi', anasema John Mrema, mmoja wa wanachama wa G-55.
No Reforms, No Election, ni msimamo wa kisera wa chama hicho uliopitishwa na Kamati Kuu katika kikao chake cha Disemba 2-3, 2024 chini ya mwenyekiti aliyepita, Freeman Mbowe kabla ya kupata baraka ya Mkutano mkuu wa Januari 21, 2025 ulioongozwa na Mbowe, mkutano ambao pia ulimchagua mwenyekiti mpya, Tundu Lissu.
Kwa kupinga namna ya utekelezaji wa msimamo huo wa chama, kundi la G-55 linaonekana kuwa kundi lingine la 'uasi' ndani ya chama, linaloasi maamuzi yaliyopitishwa na vikao halali vya vyama. Hii ni dhana inayojengwa na dhana nyingine inayohusisha makovu ya uchaguzi uliopita wa ndani wa chama, uchaguzi wa Januari, 2025. Ulikuwa uchaguzi wenye mvutano mkali kuwahi kutokea kwenye siasa za vyama vingi Tanzania. Lissu akimbwaga kigogo aliyeongoza chama kwa miaka zaidi ya 20, Mbowe katika nafasi ya Uenyekiti kwa kupata kura 513 dhidi ya 482 alizopata Mbowe.
'Uchaguzi wa ndani ndio mzizi wa yote, ukitizama asilimia kubwa ya wanaopinga No Reforms, No Election walikuwa wafuasi wa Mbowe, unategemea nini?"", anasema Boniface Charles Mkazi wa Salasala. Hata hivyo dhana hii inapingwa vikali na John Mrema ""sio kweli', akisema wapo miongoni mwao walikuwa wakiumuunga mkono Lissu.
Dhana ya tatu, ni kuhusishwa kwa G-55 na wapinzani wa CHADEMA walio nje ya chama, wanaotajwa kufadhili kundi hili.
""Hii ni project ina pesa nyingi, wachache wanaoiongoza kwa nyuma ni wanufaika wazuri sana pamoja na watu wao walioko upande wa pili"", anaandika Godbless Lema, kwenye mtandao wake wa X na kuongeza ""Nitanyoosha rula, yaliyofanyika darini yatawekwa hadharani'.
Pengine hii itasalia kuwa dhana mpaka yatakapobainika dhahiri hadharani hapo mbeleni.
CHANZO CHA PICHA,
GETTY IMAGES
Historia ya vyama vya siasa vya upinzani nchini Tanzania inatoa funzo kubwa kuhusu athari za migawanyiko ya ndani. Vyama vingi vya upinzani vimekumbwa na matatizo ya kuvunjika na kupoteza nguvu kutokana na migawanyiko ya ndani ya kisiasa, na hii inafanya kuangalia mgogoro wa CHADEMA kuwa na umuhimu mkubwa katika kuielewa hatma ya chama hicho.
Chama cha wananchi (CUF), kiliwahi kuwa chama kikuu cha Upinzani hasa Visiwani Zanzibar ilipokuwa ngome yake, ni mfano muhimu wa chama kilichopitia mgogoro wa ndani mkubwa na hatimaye kupoteza nguvu kubwa kisiasa. Mzozo kati ya Mwenyekiti, Profesa Ibrahim Lipumba na aliyekua Katibu wake, Maalim Seif Sharif Hamad, ukaua nguvu kubwa ya CUF bara na Visiwani. Japo Chama hicho kinaendelea kupumua, lakini uhai wake leo, hauwezi kufika hata robo ya uhai wa CUF ya miaka ya 1990 na 2000.
Hadithi inafanana na chama NCCR Mageuzi, kilichokuwa chama kikuu cha upinzani kwa upande wa bara katika uchaguzi mkuu wa kwanza wa vyama vingi mwaka 1995.
Mwenyekiti wa NCCR Mageuzi wakati huo na Waziri wa zamani wa mambo ya ndani, Augustine Mrema, alishika nafasi ya pili kwenye uchaguzi wa Rais dhidi ya Benjamin Mkapa wa CCM, kwa kupata 27.7% ya kura. Ndiye aliyemfanya baba wa Taifa, Mwalimu Julius Nyerere kupanda jukwaani kumpigia 'debe' Mkapa. Lakini migogoro ya ndani ya chama, ikakiporomosha chama hicho mpaka leo.
Kwa CHADEMA, mgogoro wa sasa na ilichokipita katika uchaguzi wao wa ndani wa Januari, unaonyesha wazi kuwa hauko mbali na mifano ya karibu ya vyama vya upinzani nchini Tanzania vilivyokuwa na nguvu zaidi yake lakini vilipoteza nguvu hiyo na umaarufu kutokana na migawanyiko ya ndani.
Hii inaonyesha wazi kwamba kama kitaendelea kuikumbatia migogoro hii ya ndani kinaweza kupita na kuishia kule kule ilikopita CUF na NCCR-Mageuzi: kupoteza umaarufu wake na nafasi yake katika ushindani dhidi ya chama tawala.
CHANZO CHA PICHA,
GETTY IMAGES
Mivurugano ndani ya CHADEMA ni ya kihistoria. Ilianza muda mrefu, tofauti yake ni ukubwa, wahusika na mazingira ya mizozo husika. Ukiacha ya Chacha Wangwe, Mwaka 2013 -2015 aliyekuwa naibu katibu mkuu wa chama hicho, bwana Zito Kabwe, pamoja na mjumbe wa kamati kuu ya CHADEMA, Dk.Kitila Mkumbo na mwenyekiti wa CHADEMA mkoa wa Arusha, Samson Mwigamba walivuliwa uongozi kwenye chama na baadaye kufukuzwa kwa kile kilichoelezwa kutaka 'kumpindua' Mbowe.
Waraka wa mwaka 2013, uliotaja wahusika wake kwa majina ya M1, M2 na M3, ulieleza kutaka mabadiliko makubwa ndani ya chama ukimuelezea Zitto kama kinara atakayesimamia mabadiliko hayo kuchukua nafasi ya Mbowe. Japo Zitto alisema waraka ulimuhusu yeye lakini hakuwa ameuona mpaka alipoitwa kwenye Kamati Kuu, CHADEMA ilivuka kwa kiasi chake mgogoro huu.
Baada ya uchaguzi wa Oktoba 2015, CHADEMA ikaanza kuwa na migogoro ya ndani na wabunge wa chama hicho walioanza kuunga mkono juhudi kwa kuamia CCM. Hapo hapo ikawa na kitendawili cha ama iwasilishe majina ya wabunge wa viti maalum ama la ili waweze kuteuliwa kuingia bungeni, kwa kuwa hawakukubaliana na matokeo ya urais.
Mzozo ukaibuka baada ya kundi la wabunge 19 wanawake wakiongozwa na Halima Mdee, walipachikwa jina la utani la 'Covid-19' kutoka Chadema kufanya uamuzi wenye utata wa kwenda bungeni na kuapishwa na kuwa wabunge wa Bunge la 12.
Mpaka leo bunge linakwenda kuvunjwa chini ya miezi mitatu ijayo, mzozo huo hauna hatma. CHADEMA iliwafukuza, lakini wabunge hao wameendelea kuwepo mpaka leo.
Mgogoro ulioliingiza mpaka Bunge la Jamhuri ya Muungano wa Tanzania na Tume ya Taifa ya Uchaguzi, maswali yakiwa mengi. Wameteuliwaje? na nani? na nani kapeleka majina bungeni wakati CHADEMA imekataa kutoa ridhaa?Chama kikaja kuwafukuza, lakini wapo bungeni, kwanini? ikiwa sheria inasema Mbunge lazima atokane na chama, na akifukuzwa uanachama na ubunge wake unakoma?
Kwa muktadha wa mgogoro wa sasa, na ukaribu wa muda wa Uchaguzi Mkuu, mazingira yanaiweka njia panda CHADEMA.
CHANZO CHA PICHA,
GETTY IMAGES
CHADEMA sasa iko kwenye njia panda. Kila upande (wanaounga na wasiounga mkono No reform, No Election) una hoja yenye nguvu, lakini pia kila uamuzi unakuja na gharama zake. Kusimamia msimamo wa ""No Reforms, No Election"" kunaweza kuipa taswira ya chama cha msimamo thabiti, lakini pia kunaweza kuwaweka wanachama wengi nje ya mfumo wa siasa kwa miaka mingine mitano.
Kwa upande mwingine, kuwaruhusu wanachama kushiriki uchaguzi huku msimamo wa kitaifa wa chama ukiendelea unaweza kuonyesha ustahimilivu na ufanisi wa kisiasa, lakini pia kuna hatari ya kupokea lawama za kutokuwa waaminifu kwa misingi ya harakati.
Lakini vyovyote itakavyokuwa lazima CHADEMA iamua kusuka ama kunyoa. Ama wote waendelee na msimamo ama wote wauache msimamo wa No reform, No Election.
Ikiamua kuendelea na msimamo Je CHADEMA itaweza kuikabili dola kuzuia Uchaguzi? ni jambo rahisi? kwa gharama ipi na ya nani? pengine inazo mbinu, ni jambo la kusubiri. Makamu Mwenyekiti wa CCM, Tanzania Bara, Stephen Wasira, na Emmanuel Nchimbi, katibu Mkuu wa CCM na Mgombea mwenza (Makamu wa Rais) kwa Mgombea Urais Dkt. Samia Suluhu Hassan katika uchaguzi mkuu wa mwaka huu wa 2025, kwamba uchaguzi upo na hakuna mamlaka yenye uwezo wa kuzuia uchaguzi usifanyike.
Wapo wanaojaribu kuwatoa kwenye njia panda waliyo nayo CHADEMA. Mratibu wa Mtandao wa Watetezi wa Haki za Binadamu (THRDC), Onesmo Ole Ngurumwa yeye anashauri chama hicho kuketi meza moja na G55′ ili kumaliza mzozo.
""Rafiki zangu Lissu , Heche (John ) Lema (Godbless) na Mnyika (John) tafuteni namna mkae na G55 yenu. Tupo tayari kusaidia majadiliano haya kati ya uongozi wa chama na G55 ili tuendeleze utamaduni wa mazungumzo pale tunapotofautiana kimitazamo,"" amesema.
Lakini kama Ilishindikana kukaa pande mbili wakati huo wa mizozo ya kina Zitto Kabwe na Mkumbo, haionekani kuwezekana kwa kina Halima Mdee na wabunge wenzake 19, itawezekana kwa kina John Mrema leo na G-55? Maswali haya ndiyo yanazidi kuongeza mjadala wa hoja ya mustakabali wa chama hicho.
Kwa sasa, uongozi wa CHADEMA unapaswa kutumia busara ya hali ya juu. Kupuuza hoja za G-55 kunaweza kuwa kosa la kisiasa, lakini kuzisikiliza kunaweza kuwafanya waonekane dhaifu, kosa lingine. Vyovyote itakavyokuwa, kujenga mshikamano na kuepuka kile kilichowapata vyama kama CUF na NCCR-Mageuzi ndiyo njia pekee ya kukiepusha kupoteza nguvu na ushawishi wake.
Imehaririwa na Ambia Hirsi
© 2025 BBC. BBC haihusiki na taarifa za kutoka mitandao ya nje. Soma kuhusu mtazamo wetu wa viambatanishi vya nje.
"
Long Article,"Kwanini kande, mbege na machalari ni bora kuliko Pizza na Burger?",7 Aprili 2025,"""Tulifanya utafiti huu kwa kushirikiana na Taasisi mbalimbali za kimataifa, lakini tukalenga Moshi, Kilimanjaro kwa sababu watu bado wanatumia vyakula vya jadi,"" anasema Godfrey Temba, mtafiti kutoka timu ya utafiti ya KCMC, ambaye pia Daktari wa kinga ya mwili.
Vyakula vilivyofanyiwa utafiti ni vyakula vya asili, kienyeji, jadi na Afrika ambavyo hasa vilikuwa vyakula vya watu wa asili ya Kilimanjaro, ambao wengi ni Wachaga, dhidi ya vyakula vya kisasa, vya mjini na vinavyotumika zaidi na watu wa Magharibi.
Washiriki wa utafiti waligawanywa kwenye makundi matatu, kundi la kijijini, ambao walibadilisha mlo kutoka kula vyakula vya asili wakala vyakula vya kisasa kwa wiki mbili, kundi la pili ni la wale wa mjini waliobadili mlo na kula vyakula vya asili na kienyeji kwa wiki mbili pia, na kundi la tatu walipewa kinywaji cha asili ya mbege inayotengenezwa kwa kutumia ndizi mbivu, kimea cha ulezi, na maji.
Baadhi ya vyakula vya asili vilivyotumika ni kande (mahindi na maharage), Machalari (ndizi nyama), Kiburu (ndizi maharage) kinywaji cha asili cha mbege, mbogamboga, viazi vitamu, ugali wa dona au muhogo, uji wa ulezi, matunda ya msimu kama parachichi na chai ya rangi. Ingawa vyakula hivi pia vinatumika na baadhi ya watu wa asili nyingine mbali na Wachaga. Kande iliyotumia mahindi yasiyokobolewa, ikiwekwa chumvi kidogo bila mafuta ni chakula cha asili chenye afya.
Kwa upande wa vyakula vya kisasa, washiriki walipewa wali mweupe wa mafuta, mikate ya Sandwich, chapati, Juisi za pakiti, Soseji na Chipsi mayai, tambi, ugali wa sembe, pizza na chai ya maziwa, vyakula vilivyozoeleka mijini na kwenye migahawa ya haraka. Vyakula hivi vinalika sana Ulaya Magharibi, vinavyojumuisha pia vyakula kama Pizza na Burger.
Matokeo ya utafiti yameonesha kuwa wale waliobadili lishe kwenda ya Kimagharibi kinga zao zilianza kupungua uwezo wake, pia protini zao mwilini ziliongezeka zinazohusiana na uvimbe mchungu (inflammation) ambazo zikiongezeka kwa kasi na kwa muda mrefu zinasababisha kupata hatari ya kupata magonjwa yasiyokuwa ya kuambukiza kama ya moyo, kisukari, na saratani.
Kwa upande mwingine, waliorejea kwenye lishe ya Kiafrika au waliotumia mbege walionyesha kupungua kwa viashiria vya uvimbe mchungu, na hali yao ya kinga zao za zilionyesha kuimarika.
'Tulijifunza kwamba lishe zetu za asili zina uwezo mkubwa sana wa kuimarisha kinga zetu za mwili na kutuweka mbali na hatari ya kupata magonjwa yasiyokuwa ya kuambukiza na hizi lishe zetu za asili hasa katika eneo la Kilimanjao, ni lishe ambazo watu wanatumia nafaka zaidi kama mahindi, ambayo maeneo ya vijijini wengi wanatumia ambayo hajakobolewa, ndizi nyama (Machalari), ndizi na maharage (Kiburu)"", alisema Temba.
Kwa mujibu wa utafiti, baadhi ya madhara au faida za mabadiliko ya lishe ziliendelea kuonekana mpaka wiki nne baada ya utafiti, jambo linaloonesha kuwa vyakula unavyokula vinaweza kuwa na athari nzuri ama mbaya ya muda mrefu kwenye afya yako.
CHANZO CHA PICHA,
GETTY IMAGES
Utafiti huu sio wa Moshi pekee. Ni sehemu ya utafiti mpana uliohusisha nchi kama Uingereza, Afrika Kusini, Brazil, na Marekani, ukishirikisha jumla ya washiriki 1,205. Katika nchi za Magharibi, walioshiriki walikuwa na ulaji mkubwa wa vyakula vilivyosindikwa kwa wastani wa zaidi ya 45% ya mlo wao wa kila siku.
Tanzania ilitoa kundi dogo la watu 77, lakini mchango wake ulikuwa wa kipekee, hasa kwa sababu ya tofauti kubwa katika aina ya lishe inayopatikana maeneo ya vijijini na mijini na pia bado kuna jamii zinazotegemea lishe ya asili. Matokeo yake yaliwawezesha watafiti wa kimataifa kuthibitisha kwamba lishebora si swala la teknolojia, bali ni urithi wa maisha ya kawaida unaohitaji kuthaminiwa tena.
Utofauti wa mazingira mijini dhidi ya vijijini ulionesha kuwa watu wanaoishi maeneo ya vijijini au wenye mtindo wa maisha wa jadi walikuwa na kinga bora zaidi tofauti na wale waliotegemea vyakula vya haraka na vya kusindika na kukobolewa. Pia utafiti ulionyesha vijijini wengi wanaanda vyakula vyao kwa kuvichemsha na kuweka kiwango kidogo cha chumvi na mafuta, kuliko kundi la mjini.
Lakini Utafiti mwingine wa kimataifa uliofanywa na vyuo mbalimbali vikiwemo vya Harvard na Oxford umeonyesha athari za lishe ya asili na matumizi ya vyakula visivyosindikwa vinamchango mkubwa wa kupunguza hatari ya magonjwa sugu kama vile kisukari, magonjwa ya moyo, na saratani.
""Ukitazama data, unaona wazi kuwa watu wa vijijini ambao lishe yao haijachakachuliwa sana walikuwa na mwitikio mzuri wa kinga. Lakini hata wale wa mjini, walipobadilishiwa chakula kwa siku 14 tu, walionyesha matokeo mazuri,"" asema Temba.
Licha ya watafiti kuonya kula kwa wastani hasa vyakula vya wanga kama viazi, magimbi na nafaka, Utafiti huu unathibitisha umuhimu wa lishe ya asili, na jinsi vyakula visivyopitia viwanda vinavyoweza kuboresha mfumo wa kinga na afya ya mwili kwa ujumla.
CHANZO CHA PICHA,
GETTY IMAGES
Utafiti huu sio tu kuhusu utofauti wa vyakula vya asili ya kiafrika na vile vya Magharibi, bali unatoa ujumbe mpana kwamba lishe ni nguzo muhimu ya kinga ya mwili. Katika kipindi ambacho magonjwa yanazidi kuongezeka, na ulimwengu ukikabiliwa na changamoto mpya kila mwaka, lishe bora inaweza kuwa ngome ya kwanza ya ulinzi.
Kwa hiyo, badala ya kulazimika kuchagua kati ya ""kitamu"" na ""cha afya,"" tunapaswa kutambua kwamba ladha halisi iko kwenye vyakula vya nyumbani na kwamba afya ya muda mrefu inaanzia kwenye mlo wetu wa kila siku.
'Ukiweka mbali suala la ladha lakini hata mtu anavyojisikia inakuwa ni tofauti sana na jinsi ambavyo umezoea kula Chipsi, kula burger ukilinganisha na kula magimbi mazuri ya kienyeji', alisema mmoja wa washiriki wa utafiti.
Hata hivyo changamoto inayotajwa na wengi ni upatikanaji wa lishe ya asili hasa kwa watu waishio mjini.
""Nilishindwa kuendelea na ulaji wa chakula cha asili kutokana na mtindo wa maisha tunaoishi...na kwamba hivi vyakula vya asili upatakanaji wake na upishi mzuri kwa maeneo ya mjini ni mgumu sana', anasema mshiriki.
Pamoja na changamoto kula vyakula vya asili na kuvilinda ni wito unaozungumzwa na watafiti. Huenda leo kande, viazi vitamu, magimbi, mbege na mboga za kienyeji zikawa hazijafungashwa kwenye maboksi na vifungashio vingine vya kuvutia kama ilivyo burger au pizza, lakini ndani yake kuna kinga isiyolipiwa, kinga ambayo sasa imethibitishwa kisayansi.
Imehaririwa na Ambia Hirsi
© 2025 BBC. BBC haihusiki na taarifa za kutoka mitandao ya nje. Soma kuhusu mtazamo wetu wa viambatanishi vya nje.
"
