Type,Title,Date,Text
Long Article,Tundu Lissu ashitakiwa kwa uhaini Tanzania,10 Aprili 2025,"Tundu anayetetewa kwa sasa na Mawakili sita ambao ni Dk. Rugemeleza Nshalla, Dickson Matata, Jebra Kambole, Michael Lugina, Hekima Mwasipu, na Gaston Garubindi, alisomewa shitaka hilo la uhaini Wakili Nassoro Katuga
Mbali na Shitaka hilo anatuhumiwa kwa kuchapisha taarifa za uongo kuhusu kuharibiwa kwa uchaguzi wa Serikali za mitaa 2024, kutumika kwa Polisi kuipa kura na Majaji kutotenda haki kwa kuwa ni wateule wa Rais.
Hata hivyo Mahakama hivyo imesema haina uwezo wa kusikiliza makosa ya uhaini na kuhairisha kesi mpaka April 24, 2024.
Awali Jeshi la Polisi nchini Tanzania lilisema lilimkamata Lissu jana mkoani Ruvuma kwa tuhuma za kufanya uchochezi wa kutofanyika Uchaguzi Mkuu 2025.
Aidha Polisi nchini humo kupitia taarifa yake ilitoa onyo kwa vyama vyote vya siasa kutotoa maneno ya uchochezi, kashfa kwa Polisi na Serikali au viashiria vyovyote vya uvunjifu wa amani katika kipindi hiki cha kuelekea Uchaguzi Mkuu.
Mapema Polisi walipiga mabomu ya machozi na kuwatawanya wafuasi wa chama kikuu cha upinzani nchini Tanzania, Chadema huku wakizua viongozi wa chama hicho kufanya mkutano na waandishi wa habari.
Vyombo vya habari vya ndani vimeripoti kushikiliwa pia kwa Makamu Mwenyekiti wa chama hicho bara, John Heche, Mjumbe wa Kamati kuu, Godbless Lema, Mwenyekliti wa chama hecho kanda ya Kusini, Aden Mayala na Mkurugenzi wa Mawasiliano na uenezi, Brenda Rupia.
Lissu alikamatwa hapo jana baada ya kumaliza mkutano wa hadhara mkoani Ruvuma, kusini mwa Tanzania. Akiendelea kunadi msimamo wa chama hicho wa 'No Reforms, No Election,
No Reforms, No Election, ni msimamo wa kisera wa chama hicho uliopitishwa na Kamati Kuu katika kikao chake cha Disemba 2-3, 2024 unaodai kuwa CHADEMA haitoshiriki uchaguzi mkuu wa mwaka huu kama hakutafanyika mabadiliko ya kimfumo katika uchaguzi, ikiwa ni pamoja na marekebisho ya katiba, sheria, na kuhakikisha kuwepo kwa tume huru ya uchaguzi.
Zaidi Lissu na chama hicho unaeleza kwamba uchaguzi hautafanyika nchini humo kama marekebisho wanayodai hayatafanyika.
Taarifa ya jana ya chama hicho inadai kutofanyiwa haki na jeshi hilo.
© 2025 BBC. BBC haihusiki na taarifa za kutoka mitandao ya nje. Soma kuhusu mtazamo wetu wa viambatanishi vya nje.
"
Long Article,Fahamu majengo 10 marefu zaidi barani Afrika 2025,"11 Aprili 2025, 05:55 EAT","Makala haya yanaorodhesha majumba marefu zaidi katika bara la Afrika.
CHANZO CHA PICHA,
CHINA CONSTRUCTION COMPANY LIMITED
The Iconic Tower ni jumba refu lenye matumizi mchanganyiko katika Mji Mkuu Mpya wa Utawala wa Misri.
Likiwa na urefu wa mita 400 (futi 1,300), ndilo jengo refu zaidi barani Afrika.
Jengo hilo lina ghorofa 77, nyingi zikiwa za matumizi ya ofisi.
Djamaa el Djazaïr unaojulikana kama Msikiti Mkuu wa Algiers ulifunguliwa mwezi Aprili 2019, ukiwa na mnara mrefu zaidi ulimwenguni.
Msikiti huo ni wa tatu kwa ukubwa duniani baada ya Msikiti Mkuu wa Mecca na Al-Masjid an-Nabawi wa Madina huko Saudi Arabia.
Msikiti huo una jumba la maombi (salat) lenye ukubwa wa 22,000 m2 (240,000 sq ft), linaloweza kutumika na takriban waumini 120,000.
Jumba la Mohammed VI lina ghorofa 55, na urefu wa mita 250 (futi 820) katika jiji la Salé, linalopakana na Rabat, mji mkuu wa Morocco.
Ni jengo refu zaidi nchini Morocco na la tatu kwa urefu barani Afrika.
Ni mradi wa mfanyabiashara wa Morocco Othman Benjelloun na kuongozwa na kampuni ya O'Tower.
CHANZO CHA PICHA,
GETTY IMAGES
Leonardo ni jengo lenye ghorofa 55 lenye matumizi tofauti huko Sandton, Johannesburg, Afrika Kusini.
Jengo hilo ambalo ni la nne kwa urefu barani Afrika ndilo refu zaidi Afrika Kusini na Jangwa la Sahara.
Lina urefu wa mita 234 ikiwa ni futi 768.
Jengo hilo limejengwa katika Mtaa wa 75 Maude, takriban mita 100 kutoka Soko la Hisa la Johannesburg.
CHANZO CHA PICHA,
HOBERMAN COLLECTION
Jumba la Carlton Center ni jumba lenye ghorofa 50 na kituo cha ununuzi kilicho jiji la Johannesburg, Afrika Kusini.
Likiwa na urefu wa mita 223 (futi 732), limekuwa jengo refu zaidi barani Afrika kwa miaka 46 tangu kukamilika kwake mwaka wa 1973.
Msikiti wa Hassan II ni msikiti uliopo Casablanca, Morocco. Ni msikiti wa pili kwa ukubwa barani Afrika na ni wa 14 kwa ukubwa duniani.
Mnara wake ni mnara wa pili kwa urefu duniani ukiwa na mita 210 (futi 689).
Ulikamilishwa mnamo 1993, chini ya mwongozo wa Mfalme Hassan II.
Jumba hilo lina ghorofa 60.
Makao Makuu ya Benki ya Biashara ya Ethiopia ni jumba refu zaidi mjini Addis Ababa, Ethiopia ambalo lilikamilika tarehe 13 Februari 2022 na kuwa jengo refu zaidi nchini Ethiopia.
linatumika kama makao makuu ya Benki ya Biashara ya Ethiopia yanayomilikiwa na serikali, benki kubwa zaidi nchini humo.
Pia ni jengo refu zaidi katika Afrika Mashariki
Britam Tower ni jengo la kibiashara jijini Nairobi linalomilikiwa na British-American Investments Company (Britam).
Jengo hilo ambalo ndilo refu zaidi nchini Kenya, lina urefu wa mita 195 (futi 640) kutoka ardhini, likiwa na ghorofa 32 zinazoweza kutumika.
Jengo hili lina umbo la kipekee la prismic, ambalo huanza kama alama ya mraba ya pande nne na kuishia na paa la pande mbili na mlingoti wa mita 60 (197 ft)
Jumba la Global Trade Center (GTC Office Tower) ndio refu zaidi kati ya majumba ya Global Trade Center jijini Nairobi yanayomilikiwa GTC Industry Ltd.
Jumba hilo lina urefu wa mita 184 (futi 604) na ghorofa 42.
CHANZO CHA PICHA,
ANADOLU AGENCY
Jumba la Ponte City ni jengo lililopo katika wilaya ya Berea ya Johannesburg, Afrika Kusini, karibu tu na Hillbrow.
Iilijengwa mwaka 1975 na lina urefu wa mita 173 (futi 567.6).
Limekuwa jumba refu zaidi la makazi barani Afrika kwa miaka 48, hadi lilipopitwa mwaka 2023 na Jengo la D01, katika Mji Mkuu Mpya wa Utawala wa Misri.
Ni Jengo la ghorofa 55.
Imehaririwa na Ambia Hirsi
© 2025 BBC. BBC haihusiki na taarifa za kutoka mitandao ya nje. Soma kuhusu mtazamo wetu wa viambatanishi vya nje.
"
Long Article,"Manupuli: Je, ni kweli miti hii huuma na kung'ata watu na mifugo?",10 Aprili 2025,"Timu ya BBC, pamoja na maafisa wa misitu, walitembelea kijiji cha Valagajji.
Tulipoingia kijijini, tuliona mti mkubwa wa mkwaju na mti wa mnazi. Pamoja na ana hii, tuliona miti mingi ya misaji, ndizi, mlozi, na saffron... na miti mingine mingi. Ikilinganishwa na miti katika maeneo mengine, hii haikuwa na kitu cha pekee. Ilikuwa ya kawaida.
Kijiji hiki, ambacho kina takriban familia 60, kina idadi ya watu 210. Wote wanategemea ufugaji na kilimo kwa maisha yao. Kuna vibanda na uzio iliyotengenezwa kwa miti ama fito kwenyebaadhi ya nyumba. Watu wawili au watatu walionekana wakienda kwenye bustani wakiwa na mapanga mabegani mwao.
Jamii hiyo inasema kuwa fito na miti katika kijiji hicho huwauma watu na mifugo, pamoja na kuwazingira wapita njia. Wameiita miti hiyo Manupuli.
Wanakijiji wanasema kuwa mti huu una makucha kama ya tiger, ndiyo maana unaitwa Manu-Puli.
""Miaka kumi iliyopita, nilipokwenda kwenye kukata miti, fito moja ilininasa mguuni mwangu, na ilibidi mpaka nishonwe nyuzi kutokana na jeraha,"" Gatikamma, mwenye umri wa miaka 62, aliiambia BBC.
""Nilipokuwa nikipiga kelele, mke wangu aliona na kukata na kisu, na kimti hicho kiliniacha. Hivyo ndivyo nilivyookoka,"" alisema Gatikamma.
""Nilienda kumwagilia ng'ombe karibu na mti. Kisha mti wa misaji ulikama mkia wa ng'ombe wetu. Kisha tukaukata kwa kisu na kuondoka,"" alisema Mounika kutoka kijiji cha Valagajji kwa BBC.
Dk. J. Prakasarao, mtaalamu wa mimea katika Idara ya Botania ya AU, aliiambia BBC kuumwa na kung'atwa na miti hakutokei.
""Kawaida, wakati mifugo inafungwa karibu na nyumba au kupelekwa msituni... utaona kuwa mikia ya mifugo ni mikavu. Mikia inaweza kujifunga kwenye vijiti, Mifugo, isiyoweza kujinasua vizuri, hujaribu kujifunga zaidi. Wanajifunga kwa nguvu. Katika matukio kama haya, watu hufikiri kuwa kijiti au mti umewakamata,"" alieleza Dk. Prakash Rao.
Dk. Prakash Rao alisema kuwa binadamu pia wakati mwingine wanaweza kupata hali kama hiyo wakati nguo zao zinapogusa miti.
Maafisa wa misitu wanasema kuwa hata kama hakuna Wanyama ama... miti wakati mwingine inaweza kuwa hatari.
""Kuna uwezekano wa ajali wakati kuna nyaya za umeme zinaning'inia karibu na miti. Ikiwa tunategemea mti wowote wakati wa kupanda au kushuka milima... ikiwa ni dhaifu, tutateleza. Kuna uwezekano wa miti iliyokufa kudondoka na kutuangukia sisi. Pia kuna uwezekano wa miti kuanguka wakati wa radi na umeme. Lakini, miti haiwakamati au kuwaumiza watu au wanyama,"" alisema Neelaveni.
Dk. Prakash Rao alisema kuwa miti hata matawi, fimbo, fimbo na vigogo vyake havina sifa ya kuwavuta, kuwang'ata watu na mifugo.
""Kuna uwezekano kwamba vidole vyetu au ngozi inaweza kuingia kwenye upenyo au uwazi wakati wa kukata miti na kukwama kwa nguvu, na kusababisha majeraha. Hii kawaida huitwa kuumwa. Ikiwa hiyo itatokea, inaweza kutokea... Rao namaanisha binadamu anaifuata miti ambayo inamshika wakati wa shughuli zake za kawaida, lakini miti yenyewe haina sita ya kukufuata na kung'ata na kuumiza watu. Hiyo linaonekana tu kwenye filamu,"" alisema Dk. Prakash Rao.
Ingawa jamii za kiasili katika kijiji cha Valagajji wanaamini kuwa miti, na magogo yake yanaweza kuumiza, kuwakamata watu na mifugo, wataalamu na maafisa wa misitu wanasisitiza kuwa haya ni matokeo ya imani za asili na si matukio halisi. Uelewa wa kisayansi unahitajika ili kuelewa na kuelezea matukio haya, na elimu zaidi inapaswa kutolewa kwa jamii hizi ili kuondoa hofu zisizo na msingi.
© 2025 BBC. BBC haihusiki na taarifa za kutoka mitandao ya nje. Soma kuhusu mtazamo wetu wa viambatanishi vya nje.
"
Long Article,Tetesi kubwa 5 za Soka Ulaya jioni hii: Baada ya Mo Salah sasa Virgil van Dijk,Saa 7 zilizopita,"Ni jambo kubwa kwa Liverpool huku Salah akiwa na kiwango kizuri msimu huu, na kuisaidia klabu hiyo kukaribia kutwaa taji lao la 20 la ligi.
Mchezaji huyo wa kimataifa wa Misri ameisaidia Liverpool kuwa kileleni mwa Ligi Kuu ya England akiwa amefunga mabao 27 na kutoa asisti 17.
Salah ameshinda Ligi Kuu, Ligi ya Mabingwa, Kombe la FA na Vikombe viwili vya Ligi pamoja na Kombe la UEFA Super Cup, Kombe la Dunia la Klabu ya FIFA huko Liverpool.
Salah anasema ""Bila shaka nimefurahi sana,"" aliambia tovuti rasmi ya Liverpool. ""Tuna timu kubwa sasa. Kabla pia tulikuwa na timu kubwa. Lakini nimesaini kwa sababu nadhani tuna nafasi ya kushinda mataji mengine na kufurahia soka langu.
Mlinzi wa timu hiyo, Virgil van Dijk nae atasaini mkataba mpya wakati wowote baada ya kufikia makubaliano na Liverpool.
CHANZO CHA PICHA,
GETTYGOAL
Mshambuliaji wa Eintracht Frankfurt, Hugo Ekitike amekoleza tetesi za uhamisho wake kuelekea Arsenal! baada ya kuchapisha picha inayofananisha ushangiliaji wake unaofanana kabisa na ushangiliaji wa nguli wa zamani wa Arsenal, Thierry Henry dhidi ya Tottenham (Goal.com)
Alichapisha picha hiyo baada ya mchezo dhidi ya Tottenham Hotspur. Nyota huyo mwenye umri wa miaka 22, alianza kuifungia Eintracht Frankfurt katika pambano lao la Ligi ya Europa dhidi ya Hotspur Alhamisi usiku kwa bao kali, lakini ni shangwe yake ambayo ilivutia macho ya mashabiki wa Arsenal, wakisema ni dalili anatajiunga Arsenal.
CHANZO CHA PICHA,
GETTY IMAGES
Kocha wa Chelsea, Enzo Maresca anasema: ""Namba tisa yangu iko kamili kabisa na ni Nico Jackson. Tayari tuna namba tisa"".
""Na kwa kuwa sasa Sasa si kipindi cha majira ya kiangazi. Kama tunaweza kupata anayefanana na Nico, basi sawa. Nimesema mara nyingi, na mnaweza kuona pia, tukiwa na Nico timu yetu huwa bora zaidi. Nico ndiye tunayemhitaji"". (Chelsea Press)
Nahodha wa zamani wa Arsenal Patrick Vieira anafikiriwa kuwa kocha mpya wa Roma, kulingana na Sky nchini Italia.
Vieira kwa sasa ni kocha wa Genoa na amewaongoza hadi nafasi ya 12 kwenye ligi.
Sky nchini Italia wanaripoti kwamba Stefano Pioli, Maurizio Sarri na Vincenzo Montella pia wanazingatiwa, huku Vieira akiwa wa nne kwenye orodha hiyo.
Vieira alistaafu soka mwaka wa 2016 na amekuwa meneja katika klabu ya New York City FC inayoshiriki Ligi ya MLS, Nice kwenye Ligue 1, Crystal Palace, Strasbourg na Genoa tangu 2024.
Kwa mujibu wa Catalunya Radio, Barcelona inamuania mlinda mlango wa Real Sociedad Alex Remiro ambaye amepangwa kuwasili Camp Nou siku zijazo.
Ripoti hiyo inasema kwamba mawasiliano tayari yamefanywa na wawakilishi wa kijana huyo mwenye umri wa miaka 30 kuhusu uhamisho hapo baadaye.
Huku mchezaji huyo wa kimataifa wa Hispania akiwa na kandarasi hadi 2027, inaelezwa kwamba uhamisho wa 2026 unawezekana kwa Barcelona kutokana na bei ya Remiro kupunguzwa.
Remiro amekuwa na Real Sociedad tangu 2019, na amekuwa akiimarika kila msimu.
© 2025 BBC. BBC haihusiki na taarifa za kutoka mitandao ya nje. Soma kuhusu mtazamo wetu wa viambatanishi vya nje.
"
