Type,Title,Date,Text
Short Article,China yaapa kupigana 'hadi mwisho' baada ya tishio la hivi punde la ushuru la Trump,8 Aprili 2025,"CHANZO CHA PICHA,
GETTY IMAGES
China imesema itapambana vilivyo na nyongeza mpya ya ushuru kutoka kwa Marekani huku mataifa hayo mawili yenye nguvu zaidi kiuchumi duniani yakiwa karibu kuingia katika vita vikali vya kibiashara.
China imeishutumu Marekani kwa manyanyaso baada ya Rais Donald Trump kusema atatangaza nyongeza nyingine ya asilimia hamsini juu kwa bidhaa kutoka China iwapo nchi hiyo haitabatilisha uamuzi wake wa kuziongezea ushuru bidhaa za Marekani.
Kwa upande wake wizara ya biashara ya Beijing imesema kuwa haitakubali kamwe ‘’kushinikizwa na Marekani’’ na kuapa itapigana hadi mwisho.
Ushuru huo mpya unaweza kuacha baadhi ya makampuni ya Marekani yanayoleta bidhaa fulani kutoka China yakikabiliwa na ushuru wa asilimia 104%.
Licha ya Vietnam kuathirika zaidi na ushuru wa Trump, Waziri Mkuu wa Vietnam Pham Minh Chinh anasema nchi hiyo itanunua bidhaa zaidi kutoka Marekani, zikiwemo bidhaa zinazotumika kwa usalama na ulinzi.
kwa uagizaji wa magari kutoka Japani na kile kinachojulikana ushuru wa asilimia 24% kwa bidhaa zingine za Japani.
Rais Trump pia amesema hana nia ya kusitisha nyongeza alizotangaza kwa karibu kila nchi duniani licha ya masoko ya hisa kuporomoka.
Pia unaweza kusoma:
Zijue nchi tano zilizoathirika zaidi na ushuru mpya wa Trump
Ushuru mpya wa Trump unamaanisha nini kwa Tanzania na nchi zingine za Afrika Mashariki?
Ushuru ni nini na kwa nini Trump anautumia?"
Long Article,"Je, dunia inaelekea kwenye mdororo wa kiuchumi?",8 Aprili 2025,"Kuporomoka kwa thamani katika soko la hisa, kunamaanisha kuwa kuna tathmini ya msingi ya faida za siku zijazo kwa kampuni yanayounda soko la hisa la ulimwengu.
Kwa kiasi kikubwa, kile kinachotarajiwa katika masoko; ni kwamba ongezeko la ushuru litamaanisha gharama zitapanda na faida zitashuka.
Hilo halimaanishi mdororo wa uchumi utatokea, lakini nafasi ya mdororo kutokea ni kubwa zaidi kuliko ilivyokuwa kabla ya Trump kutangaza ushuru mpya na mpana.
Uchumi huelezwa kuwa uko katika mdororo, pale jumla ya vitu ambavyo sisi na serikali tunatumia au kuuza nje vitapungua kwa vipindi viwili mfululizo vya miezi mitatu.
Kati ya Oktoba na Desemba mwaka jana, uchumi wa Uingereza ulikua kwa 0.1%, na ripoti ya hivi karibuni ya kila mwezi inaonyesha umepungua kwa kiwango sawa na hicho mwezi Januari.
Makadirio ya kwanza ya jinsi uchumi wa Uingereza ulivyokuwa mwezi Februari, yatatolewa Ijumaa ijayo. Kwa hivyo, bado tuko mbali sana kuweza kusema tumefika katika mdororo.
Hata hivyo, katika ajali ya kuanguka kwa soko la hisa, kuna baadhi ya majeruhi wa kutisha na wanaotia wasiwasi.
Benki mara nyingi huonekana kama wakala wa uchumi. Mfuatiliaji mmoja anayeheshimika wa soko la hisa, amenambia: ""Kitu ambacho kimenitia hofu ni kuanguka kwa benki.""
Benki za HSBC na Standard Chartered - ambazo zinafanya kazi katika biashara ya kimataifa kati ya mashariki na magharibi - zote zilishuka thamani kwa zaidi ya 10% usiku mmoja kabla ya kupata nafuu.
Ishara zingine mbaya haziko kwenye soko la hisa bali kwenye ubadilishaji wa bidhaa.
Bei ya shaba na mafuta zinachukuliwa kuwa kipimo cha afya ya uchumi duniani. Zote mbili zilishuka kwa zaidi ya 15% tangu Trump alipue bomu lake la ushuru.
Miaka ya 1930, athari ya Mgogoro Mkubwa wa Kifedha na hofu wakati wa janga la Uviko 19, ni mifano mitatu iliyotuonesha kudorora kwa uchumi katika nchi kubwa.
Inaaminika kuwa hatuwezi kushuhudia kushuka uchumi kwa kiwango cha kama wakati huo katika kipindi hiki, lakini kudorora kwa uchumi nchini Marekani, Uingereza na Umoja wa Ulaya kunatarajiwa kwa kiasi kikubwa na wachambuzi wengi wa kiuchumi.
Kansela wa Uingereza Rachel Reeves, anasema gharama za kukopa za serikali huenda zikashuka kwa takriban pauni bilioni 5 hadi bilioni 6 kwa mwaka, huku wawekezaji wakimiminika kwenye usalama wa dhamana za serikali.
Lakini wana hatari ya kukabiliwa na migongano ya risiti za ushuru za serikali ikiwa na uchumi kwa ujumla utakwenda vibaya.
© 2025 BBC. BBC haihusiki na taarifa za kutoka mitandao ya nje. Soma kuhusu mtazamo wetu wa viambatanishi vya nje.
"
Long Article,Tetesi za soka Jumanne: 'Messi amtaka Kevin de Bruyne Miami',8 Aprili 2025,"Chelsea hawana nia tena ya kumsajili mshambuliaji wa Napoli na Nigeria Victor Osimhen, 26, msimu huu. (CaughtOffside)

CHANZO CHA PICHA,
GETTY IMAGES
Manchester United wana nia ya kumsajili mshambuliaji wa Wolves na Brazil Matheus Cunha, 25, ambaye kifungu cha kuachiliwa kwake cha pauni milioni 62.5 kitaanza kutumika msimu huu. (Talk sport)
Winga wa chini ya miaka 21 wa England Jamie Gittens, 20, anataka kuondoka Borussia Dortmund msimu huu wa joto. Vilabu kadhaa vya Ligi Kuu vinavutiwa naye. (Sky Germany)
Everton na Brighton wameingia kwenye kinyang'anyiro cha kumsajili mshambuliaji wa Ipswich na England U21 Liam Delap, 22, ambaye kifungu chake ha kuachiliwa cha pauni milioni 40 kitaanza kutumika iwapo Ipswich itashushwa daraja kutoka Ligi ya Premia. (TeamTalk)
CHANZO CHA PICHA,
GETTY IMAGES
Fiorentina itawezesha kuongeza mwaka mmoja katika kandarasi ya mlinda mlango wa Uhispania David de Gea, 34, na kumbakisha mchezaji huyo wa zamani wa Manchester United hadi Juni 2026. (Fabrizio Romano)
Leicester City wanatazamia kumtimua meneja Ruud van Nistelrooy baada ya kushindwa mara tisa mfululizo. (Football Insider)
Bayer Leverkusen inavutiwa na mlinda lango wa Brentford na Uholanzi Mark Flekken, 31, huku Bees ikitaka takribani euro 15m (£12.8m). (Sky Germany)
Imetafsiriwa na Lizzy Masinga na kuhaririwa na Ambia Hirsi
© 2025 BBC. BBC haihusiki na taarifa za kutoka mitandao ya nje. Soma kuhusu mtazamo wetu wa viambatanishi vya nje.
"
Long Article,Hizi ndizo barabara 6 za ajabu zaidi duniani,7 Aprili 2025,"Bila shaka, orodha ni ndefu zaidi. Hebu tuangazie sehemu moja tu, kwenye safari hii fupi kupitia barabara za ajabu.
CHANZO CHA PICHA,
GETTY IMAGES
Carretera Austral ina urefu zaidi ya kilomita 1,240 kupitia Patagonia ya Chile. Inaanzia katika mji wa bahari wa Puerto Montt, kaskazini.
Ujenzi wake ulianza mnamo 1976, lakini ulikamilishwa mnamo mwaka 2000, kwa sababu ya hatari na shida za eneo hilo. Barabara hiyo ilijengwa na takribani watu 10,000 kutoka Kamandi ya Uhandisi ya Jeshi la Chile na wengi walipoteza maisha katika mchakato huo.
Carretera Austral huvuka misitu ya asili mazingira ya kijani kibichi. Miongoni mwa wanyama wake wa mwitu ni pudu, kulungu mdogo zaidi duniani, mwenye urefu wa sentimeta 35 hadi 45.
Barabara inapoendelea kuelekea kusini, mandhari hubadilika hadi Patagonian tundra, yenye mabonde mapana ya mimea na nyanda za juu iliyofunikwa na vichaka, vilivyounganishwa na maziwa na mabwawa.
Carretera Austral na barabara zake za kufikia huvuka mbuga mbili za kitaifa: Hifadhi ya Kitaifa ya Hornopiren, inayotawaliwa na volkeno, na Hifadhi ya Kitaifa ya Queulat, yenye barafu yake ya kuvutia, ambayo vipande vya barafu huanguka mara kwa mara kwenye ziwa la bluu ya azure.
Kabla ya kufika mwisho wa njia, katika mji wa mbali wa Villa O'Higgins, barabara inavuka ardhi ya maziwa ya bluu yenye barafu. Ziwa General Carrera linapendeza, likiwa na rangi yake ya samawati.
Kwa kifupi, Carretera Austral bila shaka ni mojawapo ya njia nzuri zaidi za mandhari nzuri duniani.
CHANZO CHA PICHA,
GETTY IMAGES
Mandhari nyingine ya kuvutia inaweza kuonekana kwenye njia ya Barabara ya Tongtian, huko Zhangjiajie, katika mkoa wa Hunan (kusini mwa China).
Lakini kama wewe ni dereva, unapaswa kuwa makini kwenye barabara. kwa kupita mara 99 kwenye barabara iliyopindapinda, inachukuliwa kuwa moja ya njia hatari zaidi ulimwenguni.
Inapitia miamba mirefu ikipanda Mlima wa Tianmen, barabara hiyo huinuka kutoka mita 200 hadi 1,300 juu ya usawa wa bahari.
Ujenzi wa barabara hiyo ulichukua miaka minane, kuanzia 1998 hadi 2006. Ikionekana kutoka juu, inaonekana kama utepe mweupe uliochorwa na msanii katikati ya miteremko mikali, mabonde yenye majani mengi, na miti minene.
CHANZO CHA PICHA,
GETTY IMAGES
Licha ya pendekezo letu la kuzingatia njia, ni vigumu kutotaja mwisho wa barabara hii, ambayo pia inajulikana kama ""Barabara ya Mbinguni"".
Mizingo 99 inaongoza kwa hatua 999 za ""Ngazi ya Kuelekea Mbinguni"", zinazoelekea kwenye Pango la Tianmen, ambalo linamaanisha ""Lango la Mbinguni"" kwa lugha ya mandarini.
Tundu la asili lenye urefu wa takribani mita 131.5, upana wa mita 57 na kina cha mita 60, ni ajabu ya asili inayovutia.
CHANZO CHA PICHA,
GETTY IMAGES
Hili si daraja kama lilivyo lolote tu. Ni Daraja la Storseisundet, maarufu zaidi kati ya madaraja manane kando ya Barabara ya Atlantiki ya Norway.
Daraja ndio mahali palipopigwa picha zaidi kwenye barabara kuu. Ina urefu wa mita 260 na inaonekana zaidi kama roller coaster.
Barabara hiyo inajulikana tu kama Barabara ya Atlantiki. Ina urefu wa kilomita 8, inaunganisha miji ya Kristiansund na Molde katika vilima vya Norway, na vinaunganisha kisiwa cha Averøy na bara kupitia msururu wa visiwa vidogo.
Imeteuliwa kuwa mojawapo ya barabara 18 za kitaifa zenye mandhari nzuri. Barabara kuu inaonekana kuwa nzuri, lakini pia ni hatari, kwa sababu ya mizunguko yake.
Barabara hiyo ilizinduliwa mwaka wa 1989. Watalii wanapendekezwa kutumia muda wao kuitembelea, kuegesha magari katika kila sehemu iliyoteuliwa ili kufurahia mandhari yake ya kuvutia.
CHANZO CHA PICHA,
GETTY IMAGES
Katika sehemu hii ya barabara, ni rahisi kutazama mbele, sio chini. Au labda ni bora kujizuia kabisa.
Kwa nini handaki la Guoliang lilijengwa?
Guoliang ni kijiji kilichojitenga kilicho juu ya mwinuko wa mita 1,700, kwenye Milima ya Taihang, katikati mwa China. Wakazi wake hawakuridhika kwa sababu iliwezekana tu kufika kijijini kwa kupanda miteremko iliyopinda na mawe.
Kwa hivyo mnamo 1972, kikundi cha wakazi wa eneo hilo walianza kujenga handaki lenye urefu wa kilomita 1.2 wenyewe. Ilikuwa ni kazi ya ajabu iliyochukua miaka mitano.
Barabara yao mpya ilikuwa na upana wa mita nne pekee na ilikuwa hatari sana hasa baada ya mvua kubwa kunyesha.
Kwa upande mwingine, handaki lina ""madirisha"" 30, ambayo hukuruhusu kutazama bonde ambalo huonekana kwa mbali.
Sasa, handaki na kijiji huvutia wageni kutoka duniani kote.
CHANZO CHA PICHA,
GETTY IMAGES
Je, imewahi kutokea wakati wa kuendesha gari kwamba unaonekana kuzunguka kwenye miduara? Kwa sababu, katika mzunguko huo, hakuna chaguo jingine.
Iko hukoSwindon, kusini magharibi mwa Uingereza. Na sio mzunguko mmoja. Inaundwa na mizunguko mitano, ambayo huzunguka mzunguko wa kati.
Ilifunguliwa mnamo 1972, hapo awali iliitwa Visiwa vya Kaunti na serikali za mitaa.
Lakini wakazi wa Swindon walianza kwa upendo kuiita ""Magic Roundabout Portuguese,"" ambalo lilikuwa jina la kipindi cha watoto kilichoandaliwa na BBC kati ya 1965 na 1977.
Mwanzoni mwa miaka ya 1980, jina la utani likawa jina rasmi la barabara. Na, mnamo 2024, Magic Carousel ilishinda tuzo ya Mzunguko wa barabara wa mwaka nchini Uingereza.
Rais wa Jumuiya ya Kuthamini Mizunguko ya Uingereza (ndiyo, ipo!), Kevin Beresford, alilipa ushuru kwa Magic Carousel.
Kwake, ""kitu cha kushangaza kinatokea unapokaribia"".
""Umepeperushwa na choreography hii yote ya gari,"" Beresford anasema.
CHANZO CHA PICHA,
GETTY IMAGES
Mahali fulani Patagonia, Argentina, kwa usahihi zaidi katika km 1449 ya njia ya Kitaifa 237, unaweza kupata tukio lisilotarajiwa.
Ukipita kando ya barabara inayounganisha miji ya Neuquén na Bariloche, ghafla unaziona noti kubwa za muziki zilizochorwa kwenye lami. Wanatangaza kuwa unakaribia kufikia ""barabara ya Argentina inayoimba"".
Kwa sehemu, barabara kuu inategemea wewe kuimba. Ni muhimu kuendesha gari kwa kasi fulani, ili kuzalisha mitetemo ya sauti ambayo, pamoja, huunda wimbo.
Iliundwa mnamo 2021, ni ya kwanza na, hadi sasa, ni ""asfaltofone"" pekee, huko Amerika Kusini.
Asfaltofone ilianzishwa mwaka 1995 katika kijiji cha Gylling, Denmark. Wasanii wawili wa Denmark walichora mfululizo wa alama za mviringo, ambazo zilitoa sauti wakati mtu alipozizunguka.
Tangu wakati huo, mistari inayozingatiwa na madereva kupunguza mwendo au kuwa macho na kuwa wasikivu imekuwa muziki katika sehemu nyingi duniani.
Japani, Urusi, Korea Kusini, Umoja wa Falme za Kiarabu na Hungary ni baadhi ya nchi ambazo huwashangaza wasafiri kwa ishara hii ya kuvutia.
Katikati ya kuvuka, kwa kutumia gari kama chombo, unaweza kusikiliza nyimbo mbalimbali. Nchini China, kwa mfano, sehemu ya wimbo Ode to Joy ya Beethoven husikikaa; na, nchini Argentina, wimbo uliochaguliwa ni maarufu La Cucaracha.
Imetafsiriwa na Lizzy Masinga
© 2025 BBC. BBC haihusiki na taarifa za kutoka mitandao ya nje. Soma kuhusu mtazamo wetu wa viambatanishi vya nje.
"
Long Article,Kutana na wanasoka bibi vikongwe wanavyotishia soka la Afrika,7 Aprili 2025,"© 2025 BBC. BBC haihusiki na taarifa za kutoka mitandao ya nje. Soma kuhusu mtazamo wetu wa viambatanishi vya nje.
"
Long Article,Zelensky:Putin atafariki hivi karibuni - ni kweli na kila kitu kitakwisha,27 Machi 2025,"Alishangaza waandishi wa habari alipojibu maswali kuhusu wasiwasi alionao kwa Rais wa Urusi Vladimir Putin na kusema kuwa kifo chake kiko karibu.
Zelensky pia alieleza kuwa uongozi wa Marekani hivi sasa unashawishiwa na simulizi za Urusi.
Zelensky alieleza kwa uwazi kuwa Putin anahofia kupoteza madaraka aliyonayo.
Alisema, ""Kinachomwogopesha Putin ni kupoteza mamlaka yake. Hili linategemea ustawi wa jamii, lakini pia linategemea umri wake. Putin atakufa hivi karibuni, hiyo ni kweli, na yote haya yataisha,"" alisisitiza.
""Anaweza kufa kabla ya kumaliza maisha yake ya kihistoria ambayo ni ya kutofaulu. Hicho ndicho anachohofia. Na pia kuachwa pweke,"" Volodymyr Zelensky alijibu wanahabari hao alipoulizwa kuhusu Putin.
Rais Zelensky hakutoa maelezo zaidi kuhusu msimamo wake, isipokuwa kusema kuwa Putin anataka kurejesha Umoja wa Kisovieti (USSR) na hata zaidi ya hapo.
Akizungumzia kuhusu mapumziko ya mashambulizi ya nishati, Zelensky alithibitisha kuwa hakukuwa na mashambulizi ya Urusi dhidi ya miundombinu ya nishati usiku uliopita.
""Hii ni hali ngumu kuhusu ufuatiliaji wa mashambulizi. Hadi sasa, timu za kiufundi bado hazijajua itakavyokuwa. Lakini sitaki kusema uongo, hakukuwa na mashambulizi dhidi ya nishati usiku huu. Kulikuwa na mashambulizi kwenye miundombinu mingine ya kiraia, zaidi ya ndege zisizo na rubani mia moja, lakini hakukuwa na mashambulizi dhidi ya nishati usiku,"" alifafanua.
Pia upande wetu wa Ukraine hatukujibu kwa kushambulia miundombinu ya nishati, Zelensky aliendelea kusema.
Kuhusu mapumziko ya mapigano katika Bahari Nyeusi, Zelensky alisisitiza kuwa Warusi wanahitaji mapumziko hayo kwa sababu hawadhibiti tena ushoroba wa Bahari Nyeusi.
""Tunapigania kudhibiti eneo hili kwa sababu ni hatua muhimu kuelekea kumaliza vita. Lakini tunadhibiti hali hiyo. Meli zao huenda ziko chini ya maji au zimejificha,"" alisisitiza.
Aliongeza kuwa Warusi wanataka mapumziko ya mapigano ya nishati kama sehemu ya mapatano kuhusu Bahari Nyeusi.
""Wanataka kutawala biashara ya vyakula, lakini hawatafaulu,"" alisema Zelensky.
CHANZO CHA PICHA,
GETTY IMAGES
Rais Zelensky alijitokeza pia kupinga baadhi ya matamshi ya mjumbe wa Rais Donald Trump, Steve Witkoff, ambaye alidaiwa kutumia mara kwa mara simulizi za Kremlin.
Zelensky alieleza kuwa matamshi hayo hayasaidii juhudi za amani na badala yake yanadhoofisha shinikizo la Marekani dhidi ya Urusi.
""Tunapigana na Putin na hatutaki msaada wa watu ambao wanamsaidia. Tunataka Wamarekani wawe upande wetu. Hata kama tunachagua mbinu za kati, tunataka ziwe katikati, sio karibu na Kremlin,"" alisema.
Zelensky aliongeza kuwa Marekani leo inashawishiwa sana na simulizi za Urusi, lakini wamesisitiza kuwa wataendelea kupigana na hizi propaganda kwani wanapigania uhuru wao.
Rais Zelensky alifika Paris mnamo Machi 26, ambapo alikutana na Rais Emmanuel Macron, kabla ya mkutano wa mataifa yanayojitolea kutoa dhamana za usalama kwa Ukraine.
Hii ilikuwa ni kabla ya mkutano wa ""muungano wa walio na maono sawa"" uliofanyika Paris Machi 27, ambapo Rais Zelensky alihudhuria.
CHANZO CHA PICHA,
STATE EMERGENCY SERVICE
Siku moja kabla, Marekani na Ukraine zilitangaza makubaliano yaliyofikiwa baada ya mazungumzo yaliyofanyika Saudi Arabia, ikijumuisha makubaliano ya kutotumia nguvu za kijeshi katika Bahari Nyeusi na kutekeleza mapumziko ya mashambulizi dhidi ya miundombinu ya nishati.
Ikulu ya White House ilitangaza kuwa Marekani na Ukraine zimekubaliana kudumisha usalama wa meli, kuzuia matumizi ya nguvu, na kuzuia matumizi ya meli za kibiashara kwa madhumuni ya kijeshi katika Bahari Nyeusi.
Taarifa hiyo iliongeza kuwa makubaliano yalihusisha pia hatua za kutekeleza marufuku ya mashambulizi dhidi ya miundombinu ya nishati ya Urusi na Ukraine.
Hata hivyo, Urusi ilitoa taarifa ikisisitiza kuwa makubaliano yaliyotangazwa na White House hayakujumuisha baadhi ya masharti muhimu, ikiwa ni pamoja na ombi la kuondolewa kwa vikwazo katika sekta ya kilimo ya Urusi, ambayo itahusika katika usafirishaji wa bidhaa kupitia Bahari Nyeusi.
Pia, Urusi ilitaja masharti ya marufuku ya mashambulizi ya nishati, ambayo yanapaswa kuanza tarehe Machi 18, 2025, kwa kipindi cha siku 30, na kuna uwezekano wa kupanuliwa au kuvunjwa endapo moja ya pande zitavunja makubaliano hayo.
CHANZO CHA PICHA,
YERMAK
Upande wa Ukraine unadai kuwa hakukuwa na mashambulizi ya Urusi dhidi ya nishati tangu mwezi Machi 25, 2025.
Hata hivyo, Moscow imerekodi mashambulizi dhidi ya miundombinu ya nishati tangu Machi 18, na inadai kuwa Ukraine imeshavunja makubaliano.
Marekani bado haijatoa tamko kuhusu lini usitishwaji wa nishati ulipaswa kuanza.
Imetafsiriwa na Mariam Mjahid
© 2025 BBC. BBC haihusiki na taarifa za kutoka mitandao ya nje. Soma kuhusu mtazamo wetu wa viambatanishi vya nje.
"
